This year, it was more like a couple shivs to the ribs...|2016-10-21T14:33:44+0000
https://www.theguardian.com/us-news/2016/oct/20/bad-hombre-ombre-hair-memes-donald-trump-debate-comment?CMP=fb_us|The 2016 presidential debate season has officially faded into memory - but not before things got a little hairy.|2016-10-20T18:30:00+0000
https://www.facebook.com/GuardianUs/videos/1500967616596967/|Here's the highlights from the final debate between Donald J. Trump and Hillary Clinton - insults, false facts and all.|2016-10-20T14:15:00+0000
https://www.facebook.com/GuardianUs/videos/1500453609981701/|Donald J. Trump said he would keep the country 'in suspense' over whether he would accept the outcome of November's election. The nominee's refusal to endorse the results of the election is unheard of in American history.|2016-10-20T03:48:56+0000
https://www.facebook.com/GuardianUs/videos/1500165786677150/|A billboard has appeared alongside a Michigan highway mocking Donald Trump and his xenophobic rhetoric.|2016-10-19T22:00:00+0000
https://www.facebook.com/GuardianUs/videos/1498897000137362/|Milwaukee is one of the most politically polarized and racially segregated cities in America. In terms of life propsects, it's one of the worst American places to be young and black. So how will it vote?|2016-10-19T16:01:19+0000
https://www.facebook.com/GuardianUs/videos/1498908883469507/|Pedals, a famed black bear who wandered around New Jersey on two legs like a human, appears to have been killed in the state's first sanctioned bow and arrow hunt in four decades.|2016-10-18T19:45:00+0000
https://www.facebook.com/GuardianUs/videos/1498855023474893/|"I'd advise Mr. Trump to stop whining." - Barack Obama|2016-10-18T18:02:51+0000
https://www.theguardian.com/technology/2016/oct/18/facebook-hoax-private-photos-public-tomorrow?CMP=fb_us|False alarm, yet again.|2016-10-18T17:30:00+0000
https://www.facebook.com/GuardianUs/videos/1493534027340326/|"When you vote, that's when you experience what it truly means to be an American citizen."
1.7 million Floridians - 10% of the state's adult population - can't vote because of a prior felony conviction. This is the story of three felons who turned their lives around and are fighting to restore voting rights for fellow convicts.|2016-10-14T16:29:20+0000
https://www.facebook.com/GuardianUs/videos/1492366120790450/|"This is not something we can ignore. It's not something we can just sweep under the rug as just another disturbing footnote in a sad election season," Michelle Obama said in a speech deriding Donald J. Trump's behavior towards women.|2016-10-13T20:03:13+0000
https://www.facebook.com/GuardianUs/videos/1491135267580202/|Donald J. Trump was more popular in McDowell County than anywhere else in America during the Republican primaries. What's the power of the Republican presidential nominee's message in the poorest county of West Virginia?|2016-10-13T17:30:00+0000
https://www.facebook.com/GuardianUs/videos/1491099697583759/|"Our first introduction to him was when we were at the dress rehearsal and half-naked, changing into our bikinis," former Miss Arizona Tasha Dixon recalled on how Donald J. Trump operated at Miss USA pageants.|2016-10-12T20:00:00+0000
https://www.facebook.com/GuardianUs/videos/1490823737611355/|If you could stop your period, would you? Should you?

In episode two of Vagina Dispatches, we talk with a doctor who thinks periods are unnatural, a former Olympian, a menstrual blood artist and a formerly incarcerated woman to find out what happens when you do.|2016-10-12T14:30:00+0000
https://www.facebook.com/GuardianUs/videos/574329349421499/|Psst, Donald J. Trump: The date of the presidential election is November 8.|2016-10-12T12:56:20+0000
https://www.facebook.com/GuardianUs/videos/574297326091368/|Trump-supporting, conspiracy-spouting radio host Alex Jones claims that Barack Obama and Hillary Clinton are demons who smelled like sulfur.
So at a campaign rally on Tuesday, Obama sniffed himself to make sure...|2016-10-12T11:45:00+0000
https://www.facebook.com/GuardianUs/videos/1489875484372847/|Guardian journalist Gary Younge is spending the next month in Muncie, Indiana, taking a unique look at the 2016 election and what issues are driving voters' decisions. It's a collaborative project and here's how you can get involved. You can also follow the series, which runs through Nov. 11, with our Facebook event: The View from Middletown.|2016-10-11T23:00:00+0000
https://www.facebook.com/GuardianUs/videos/1488505157843213/|Or was he just, you know, sunning himself in that particular patch of fluorescent lighting?|2016-10-10T14:45:00+0000
https://www.facebook.com/GuardianUs/videos/573240532863714/|Donald J. Trump took the gloves off in the second presidential debate, with a steady stream of personal attacks against Hillary Clinton. The pair locked horns over familiar topics such as Trump's treatment of women, Clinton's emails, immigration and Syria, but it was by far the most heated encounter between the two candidates in the 2016 campaign|2016-10-10T13:30:00+0000
https://www.facebook.com/GuardianUs/videos/1488137711213291/|First thing in the presidential debate, Donald J. Trump was asked directly to explain his comments made in the controversial groping tape. His answer: "Certainly I'm not proud of it. But this is locker room talk." Then he deflected. Hillary Clinton didn't hesitate to hold him accountable.|2016-10-10T06:03:32+0000
https://www.facebook.com/GuardianUs/photos/a.456883731005366.123396.456740217686384/1487941611232901/?type=3|Who still supports Donald J. Trump? Check out our interactive to see who remains swirling in the Republican orbit: https://gu.com/p/4j7ea?CMP=fb_us|2016-10-10T00:10:23+0000
https://www.facebook.com/GuardianUs/videos/572347706286330/|Robert De Niro: "I'd like to punch Donald Trump in the face"|2016-10-08T17:05:00+0000
https://www.facebook.com/GuardianUs/videos/1485524731474589/|In 1989 five young black men were wrongfully convicted of raping a woman jogging in New York City. Donald J. Trump led the charge against them by using the type of divisive rhetoric that's become a hallmark of his campaign - and now he's circled back to accusing the group he'd already helped wrongfully vilify.|2016-10-07T17:29:55+0000
https://www.facebook.com/GuardianUs/videos/571893742998393/|According to a new report by War Child, millions of children are forced from their homes due to conflict, persecution and insecurity. Tens of thousands are born as refugees. Hundreds of thousands will end up alone without a family.|2016-10-07T17:03:31+0000
https://www.facebook.com/GuardianUs/videos/1484652664895129/|Hurricane Matthew, the fiercest Caribbean storm in nearly a decade, is on its way to the south-east US coast. Over 1.5 million people have been asked to evacuate.|2016-10-06T18:30:00+0000
https://www.facebook.com/GuardianUs/videos/571460173041750/|It might have started as a joke - but now scary clowns are getting serious.|2016-10-06T17:15:00+0000
https://www.facebook.com/GuardianUs/videos/1484487034911692/|"I say kiddingly, but I mean it: I don't care how sick you are. I don't care if you just came back from the doctor and he gave you the worst possible prognosis (meaning: it's over). You won't be around in two weeks. Doesn't matter. Hang out 'til November 8th."|2016-10-06T16:45:00+0000
https://www.facebook.com/GuardianUs/videos/1484404098253319/|To understand the culture of guns, some enthusiasts say you've got to shoot one. We travelled to Maine - where a historic push for universal background checks is up for referendum - and did just that.|2016-10-06T14:05:00+0000
https://www.theguardian.com/film/2016/oct/05/yellowface-hollywood-asian-stereotypes-birth-of-a-dragon?CMP=fb_us|How is this still happening?|2016-10-05T21:30:00+0000
https://www.facebook.com/GuardianUs/videos/1482340225126373/|Known in her home country as the Iraqi Maya Angelou, poet Faleeha Hassan now lives as a refugee within a deep pocket of Trump supporters in south New Jersey. Many of her new neighbors, she says, see her headscarf and assume she is a terrorist.|2016-10-04T17:45:24+0000
https://www.facebook.com/GuardianUs/videos/570159866505114/|Martin Shkreli, once labelled the most hated man in America, is attempting to raise money by auctioning off the chance to punch him in the face for charity. And if you're not the violent type, you could have dinner with him instead. So far, there are no serious bidders.|2016-10-03T18:13:00+0000
https://www.facebook.com/GuardianUs/videos/1480768045283591/|Mothers and daughters see their own struggles reflected in Hillary Clinton and her presidential campaign. We asked families of women to talk about why they support her candidacy and how they identify with her experiences as a woman in the workforce and as a mother and grandmother at home.|2016-10-03T16:30:01+0000
https://www.facebook.com/GuardianUs/videos/1479881642038898/|Colorado Republicans were screaming "Never Trump!" at the GOP convention. Months later, Donald J. Trump is neck and neck in the state's polls. Watch episode two of Anywhere but Washington.|2016-10-02T16:30:00+0000
https://www.facebook.com/GuardianUs/videos/568479643339803/|An ecological crisis is playing out in US forests. Millions of trees are being lost to diseases like sudden oak death, drought, insects and wildfire - much of it driven by climate change. 

Forestry officials and scientists are increasingly alarmed by the rates of loss -- and what happens next...|2016-09-29T18:00:00+0000
https://www.facebook.com/GuardianUs/videos/1475689712458091/|Colorado Republicans were screaming "Never Trump!" at the GOP convention. Months later, Donald J. Trump is neck and neck in the state's polls.|2016-09-29T17:05:00+0000
https://www.facebook.com/GuardianUs/videos/1476530679040661/|A passenger filmed the immediate aftermath at Hoboken Terminal, capturing extensive damage to the rail car and station. Follow live updates here: https://gu.com/p/557dg|2016-09-29T15:34:07+0000
https://www.theguardian.com/commentisfree/2016/sep/29/small-donors-american-politics-election-2016?CMP=fb_us#link_time=1475148859|U.S. Senator Bernie Sanders demonstrated that there *is* another way.|2016-09-29T13:35:32+0000
https://www.facebook.com/GuardianUs/videos/1475461052480957/|Meet 12-year-old Weston Imer, co-chair for Donald J. Trump's campaign in crucial Jefferson County, Colorado: "I know what I'm doing. I've been in politics since I was very young."|2016-09-29T13:05:01+0000
https://www.theguardian.com/world/2016/sep/28/canada-pacific-northwest-lng-natural-gas-pipeline-british-columbia?CMP=fb_us#link_time=1475099051|Will the real environmental leader please stand up...|2016-09-28T21:52:05+0000
https://www.facebook.com/GuardianUs/videos/1475519502475112/|SpaceX founder Elon Musk announced his plan on Tuesday to launch manned missions to Mars by 2022.

One small problem: Musk admitted that the chances of dying on the first trip - which will have about 100 passengers, with tickets likely to be $500,000 - are "quite high." 

Are you prepared to die for the chance to visit Mars? If so, why? Tell us by filling out the form available via this link: https://www.theguardian.com/science/2016/sep/28/mars-elon-musk-space-spacex-travel?CMP=fb_us|2016-09-28T17:19:41+0000
https://www.facebook.com/GuardianUs/videos/10154572220081323/|This is nine-year-old Zianna Oliphant's tearful speech to the Charlotte city council, North Carolina. Oliphant was speaking after the fatal police shooting of Keith Scott. 

"It's a shame that our fathers and mothers are killed and we can't even see them any more. It's a shame that we have to go to their graveyard and bury them. We have tears, and we shouldn't have tears."|2016-09-28T15:45:00+0000
https://www.facebook.com/GuardianUs/videos/1474503459243383/|Hillary Clinton noted Donald J. Trump "called this woman 'Miss Piggy', then he called this woman 'Miss Housekeeping'. 
"She has a name. Her name is Alicia Machado." 
And now the former Miss Universe is speaking out about how she felt shamed by Trump.|2016-09-27T17:44:07+0000
https://www.facebook.com/GuardianUs/videos/1474196169274112/|If you didn't have the time - or the stomach - to watch the full debate between Hillary Clinton and Donald J. Trump, we've got you covered.|2016-09-27T11:56:56+0000
https://www.facebook.com/GuardianUs/videos/1473925159301213/|Hillary Clinton hits back after Donald J. Trump attacks her "stamina" at presidential debate.|2016-09-27T04:53:06+0000
https://www.facebook.com/GuardianUs/videos/10154566683701323/|We asked a professional debate coach to give the candidates some advice before they step on stage tonight. His advice for Hillary Clinton? Don't talk for too long. For Donald J. Trump? Keep the insults to a minimum.|2016-09-26T19:40:00+0000
https://www.theguardian.com/commentisfree/2016/sep/26/i-might-look-country-club-rich-reality-very-very-different?CMP=fb_us#link_time=1474891343|Name: Jaimie Seaton
Debt: $16,000
Source: Credit Cards 
"By the time I married ... I had perfected the art of living on a shoestring, while cultivating an image of upscale comfort."|2016-09-26T17:41:03+0000
https://www.facebook.com/GuardianUs/videos/1473328342694228/|Hofstra University will host the first presidential debate tonight. We visited the campus to find out what students want to hear from Hillary Clinton and Donald J. Trump. You might not expect to find many Trump supporters at an allegedly liberal college but his reach is extensive.|2016-09-26T16:30:00+0000
https://www.theguardian.com/us-news/2016/sep/26/houston-shooting-gunman-people-wounded?CMP=fb_us#link_time=1474900265|Multiple people were shot inside their cars at a Houston shopping center this morning.|2016-09-26T14:46:56+0000
https://www.facebook.com/GuardianUs/videos/1472344869459242/|Most people don't know much about vaginas. We're trying to change that. Watch the full episode: https://gu.com/p/547h8?CMP=fb_us|2016-09-25T18:55:00+0000
https://www.facebook.com/GuardianUs/videos/1471247432902319/|On an average day in America, seven children and teenagers will be shot dead. Gary Younge tells the stories of the lives lost on one random day -- November 23, 2013. Ten children died that day, including nine-year-old Jaiden Dixon, who was shot at point-blank range by his mother's ex-boyfriend on his doorstep in suburban Ohio. Most of these stories don't make the news - but they're happening every day.

Learn more: https://gu.com/p/53m8g?CMP=fb_us|2016-09-24T21:15:00+0000
https://www.facebook.com/GuardianUs/videos/1469822689711460/|Most people still don't understand what vaginas look like or how they function. In episode one of our four-part series, we're starting with the basics: we build a giant vulva, talk to a gynecologist, a labiaplasty surgeon, and a trans woman.|2016-09-23T12:05:00+0000
https://www.facebook.com/GuardianUs/videos/10154553635306323/|Kathy Miller - who was an Ohio county chair on Donald Trump's campaign until today - resigned following remarks that there was "no racism" until Barack Obama was elected, that black people have only themselves to blame for problems of the last 50 years, and that she does not care if anyone is offended by her words.|2016-09-22T17:44:35+0000
https://www.facebook.com/GuardianUs/videos/1468879279805801/|A conversation filmed at a Republican gathering in Ohio: 
"If people have jobs and go to work and do what they're supposed to do, there is no racism." 
"A lot of black people might disagree with you on that."
"That's because they're not going to work." 
"I think people might find what you're saying there a bit offensive." 
"I don't care, that's the truth."|2016-09-22T12:30:00+0000
https://www.facebook.com/GuardianUs/videos/565009057020195/|Rats still inundate major world cities, spreading disease, undermining buildings and generally grossing people out (even though they make great pets).

But thanks to one hardy biologist's birth-control innovation, perfect harmony could now become reality.|2016-09-21T20:30:00+0000
https://www.facebook.com/GuardianUs/videos/564256383762129/|A human skeleton has been discovered on a 1st century BC shipwreck, off the Greek island of Antikythera. The remains offer scientists the first real hope of sequencing DNA from an ancient shipwreck victim.|2016-09-19T19:59:02+0000
https://www.facebook.com/GuardianUs/videos/1463409153686147/|Americans own an estimated 265 million guns, more than one gun for every American adult, according to the most detailed survey of US gun ownership in a decade. But the new survey estimates that 130 million of these guns are concentrated in the hands of just 3% of American adults - a group of super-owners who have amassed an average of 17 guns each.|2016-09-19T12:05:00+0000
https://www.theguardian.com/fashion/gallery/2016/sep/18/emmys-2016-fashion-best-red-carpet-in-pictures?CMP=fb_us|The hands-down red-carpet favorites? The kids from Stranger Things.|2016-09-19T01:13:53+0000
https://www.facebook.com/GuardianUs/videos/1461402017220194/|Montreal has a rich musical heritage, with a scene that spans the jazz of Oscar Peterson to indie acts Arcade Fire and Grimes. DJ and travel writer Woody Anderson drops into Little Burgundy with local band Milk and Bone, takes a cycle tour round Boulevard Saint Laurent and The Mile End with local guides Spade & Palacio, and hooks up with warehouse party scene supremo Seb Cowan of Arbutus records.|2016-09-17T15:30:00+0000
https://www.facebook.com/GuardianUs/videos/10154534287731323/|In the 18 years since Zed Nelson's seminal photography book Gun Nation was published, 500,000 Americans have been killed by guns. Nelson returns to the people he met and asks why America stills has an insatiable appetite for firearms.

Watch Gun Nation now: https://www.theguardian.com/world/ng-interactive/2016/sep/16/gun-nation-a-journey-to-the-heart-of-americas-gun-culture-video?utm_source=facebook&utm_medium=social&utm_content=gun-nation&utm_campaign=documentaries|2016-09-16T15:41:11+0000
https://www.facebook.com/GuardianUs/videos/1462130373814025/|The numerous atolls that make up this island nation are now regularly swamped due to sea level rise. And as more people flee for the United States, many fear their culture will be lost to a country that has already taken so much from them...|2016-09-15T14:23:50+0000
https://www.facebook.com/GuardianUs/videos/10154528352611323/|NSA whistleblower Edward Snowden tells the Guardian's Ewen MacAskill why he should be granted a pardon by the US government. He also discusses the dangers of Donald Trump's rhetoric on mass surveillance - and what he makes of Oliver Stone's new movie|2016-09-14T19:30:00+0000
https://www.facebook.com/GuardianUs/videos/1460388677321528/|This is what happened off screen when Dancing with the Stars producers cut to commercial.|2016-09-13T20:15:00+0000
https://www.facebook.com/GuardianUs/videos/10154521538411323/|As the hajj begins once again, Saudi artist Ahmed Mater has revealed unprecedented changes to the holy city - from flashy new hotels to the loss of priceless neighborhoods. In the third episode of Crossing the Line, our series connecting the US and Middle East, he takes us inside Islam's urban heart.|2016-09-12T16:30:00+0000
https://www.theguardian.com/us-news/2016/sep/10/ohio-police-heroin-overdose-photos?CMP=fb_us#link_time=1473522200|Too far, or something people needed to see?|2016-09-10T15:45:39+0000
https://www.facebook.com/GuardianUs/videos/1456356761058053/|After 9/11, Hillary Clinton was livid. 

Our partners at WNYC Radio listened back to tape of the then-junior Senator - and found a politician a far cry from the controlled figure now a step away from the presidency. https://gu.com/p/527x5/us|2016-09-09T20:00:00+0000
https://www.facebook.com/GuardianUs/videos/1456241034402959/|Daniel Jones led the Senate intelligence committee's investigation into CIA torture. For the first time, he's speaking out about the mission that drove the agency to spy on him - and the consequences of letting them get away with it.|2016-09-09T17:00:00+0000
https://www.facebook.com/GuardianUs/videos/1454442571249472/|Everything you need to know about the new bells and whistles added the iPhone 7 - and the one taken away.|2016-09-07T22:41:52+0000
https://www.facebook.com/GuardianUs/videos/559179524269815/|The bikini used to represent a saucy yet uncontroversial ideal of sex, summer and youth. So what changed?|2016-09-07T20:20:00+0000
https://www.facebook.com/GuardianUs/videos/1454134061280323/|Years of drastic budget cuts have created bottomless caseloads for public defenders - the 'pack mules of the system' - and tipped the scales of justice against the poor.

This is the first installment of our three-part reporting partnership with The Marshall Project.|2016-09-07T17:15:00+0000
https://www.theguardian.com/us-news/2016/sep/06/us-election-questions-from-abroad?CMP=fb_us#link_time=1473199549|Inquiring minds from overseas have lots of questions about our crazy presidential election. Help them out:|2016-09-06T23:47:26+0000
https://www.facebook.com/GuardianUs/videos/557099607811140/|A national park in New Zealand has been granted legal personhood, meaning nobody owns it. The park has the same rights and powers as a citizen. The ruling could set a new precedent for land rights and conservation around the world.|2016-09-02T20:49:35+0000
https://www.facebook.com/GuardianUs/videos/1448855405141522/|Colin Kaepernick has recently come under heavy criticism for not standing during the national anthem. The San Francisco 49ers quarterback says he is protesting against American racial injustice and minority oppression:|2016-09-02T18:32:12+0000
https://www.theguardian.com/us-news/2016/sep/01/st-georges-school-sexual-abuse-investigation?CMP=fb_us#link_time=1472769746|One in five.|2016-09-02T02:25:18+0000
https://www.theguardian.com/world/2016/aug/31/us-cuba-first-flight-jetblue-fort-lauderdale?CMP=fb_us#link_time=1472728587|The first commercial flight between the US and Cuba since 1961 took off from Florida on Wednesday -- a symbolic next step in relations between the former Cold War adversaries.|2016-09-01T12:41:04+0000
https://www.facebook.com/GuardianUs/videos/10154486052046323/|After a brief diplomatic meeting with President Enrique Pena Nieto in Mexico to discuss the building of a wall on the US-Mexico border, Donald J. Trump returned to a rally in Arizona to deliver a hardline immigration speech. Compare and contrast the tone and delivery of his two speeches.|2016-09-01T12:09:04+0000
https://www.facebook.com/GuardianUs/videos/556140447907056/|A year ago, Russian astronomers detected a faint, unexplained signal they though might be alien communication.

When the news broke this week, everyone got very excited about it. That is, until the SETI Institute had a look.|2016-08-31T14:45:01+0000
https://www.facebook.com/GuardianUs/videos/1445908722102857/|Fort McMurray residents were forced to flee a huge wildfire that destroyed much of their city in Canada's Alberta province in May. Now, they're returning to pick up the pieces and resume their lives. Watch the full film: gu.com/p/5vcf8/us|2016-08-30T22:30:00+0000
https://www.facebook.com/GuardianUs/videos/10154480752106323/|Apple has been ordered to pay a record figure of up to $14.5bn in back taxes to Ireland by the European commission. 

This video explains the 'sweetheart deal' that the commission has ruled amounts to illegal state aid|2016-08-30T21:30:00+0000
https://www.facebook.com/GuardianUs/videos/1444966248863771/|From Young Frankenstein to Willy Wonka, here's a look back through the career of the late Gene Wilder.|2016-08-29T22:23:26+0000
https://www.facebook.com/GuardianUs/videos/1444454988914897/|Did Beyonce slay at the MTV VMAs?

Why yes. Yes she did.|2016-08-29T11:42:00+0000
https://www.facebook.com/GuardianUs/videos/1441768259183570/|Historically, presidential candidates as unpopular as Donald J. Trump faced decimation in the electoral college. But thanks to the increasing polarization of both parties and voters, that has become a thing of the past. Read more: http://trib.al/Gsql9aC|2016-08-28T13:00:01+0000
https://www.theguardian.com/global/2016/aug/27/north-korea-defectors-ian-birrell?CMP=fb_us#link_time=1472305685|"I saw a public execution aged seven, the victim's brains exploding from machine-gun fire. People cannot believe how these things happen, but for us that was normal life. It didn't seem strange. Because we were brainwashed, we thought these people deserved to die."|2016-08-27T14:15:49+0000
https://www.facebook.com/GuardianUs/videos/1441699309190465/|For #womensequalityday, listen to excerpts from the 1848 Declaration of Sentiments, which launched the feminist movement in America, and think about how far we've come and still have to go.|2016-08-26T18:00:00+0000
https://www.theguardian.com/lifeandstyle/2016/jul/20/mikael-lindnord-arthur-dog-jungle-excerpt?CMP=fb_us#link_time=1472232354|In honor of National Dog Day: meet a very, very Good Dog.|2016-08-26T17:30:21+0000
https://www.facebook.com/GuardianUs/videos/554036078117493/|Global reports have ranked Denmark as the world's happiest country for 40 years in a row.

What's their secret? Could it be masses of hygge? What even is hygge?|2016-08-26T15:00:00+0000
https://www.facebook.com/GuardianUs/videos/1440739789286417/|You used to be allowed to drive through trees, ride waterfalls, and boil an egg in the Yellowstone hot springs. 

#NPS100 #goodolddays|2016-08-25T19:55:49+0000
https://www.facebook.com/GuardianUs/videos/553744611479973/|The University of Texas at Austin students have found a novel way to protest a new state law that allows the concealed carry of guns on their campus.

Cocks Not Glocks and Gun Free UT have held protests this week - the start of the academic year.|2016-08-25T18:54:42+0000
https://www.facebook.com/GuardianUs/videos/1439585979401798/|"I just think he's a f***ing idiot."

