http://trib.al/FEWzvpA|"Emotion, however justifiable, remains a terrible guide to foreign policy, and nowhere more so than in the Middle East. Trump in Syria is eerily re-enacting Reagan's 1982 reaction to the Sabra and Shatila camp massacres in adjacent Lebanon, which sucked American marines into an unwinnable civil war from which they had to 'cut and run'."|2017-04-07T13:53:18+0000
https://www.facebook.com/GuardianUs/videos/1330083527026730/|Donald J. Trump: "Assad choked out the lives of innocent men, women and children [..] No child of god should ever suffer such horror. Tonight I ordered a targeted military strike on the airfield in Syria from where the chemical attack was launched"|2017-04-07T04:29:54+0000
https://www.facebook.com/GuardianUs/videos/1715872701773123/|Roberto Berinstain lived in the US for 20 years and owned a restaurant in Indiana with his wife - who voted for Donald Trump - before being deported to Mexico this week. Berinstain, although undocumented, had a social security number, a drivers license, permission to work legally in the US and no criminal record.|2017-04-06T22:45:00+0000
http://trib.al/YzkK4em|When the default assumption is that men cannot control themselves or that women are just that irresistible, it does a disservice to both genders.|2017-04-06T20:51:50+0000
http://trib.al/xvZZbFe|418 days after majority leader Mitch McConnell said he would never allow a vote to confirm whoever President Obama nominated to fill the seat left by Antonin Scalia, Senate rules have been changed to lower the 60-vote threshold to confirm Donald Trump's Supreme Court nominee.|2017-04-06T17:02:38+0000
http://trib.al/2CjqL78|"This decision is a game changer for lesbian and gay employees facing discrimination in the workplace and sends a clear message to employers: it is against the law to discriminate on the basis of sexual orientation."|2017-04-05T20:39:39+0000
https://www.facebook.com/GuardianUs/videos/662985107222589/|Male Dutch politicians held hands in solidarity with a gay couple who were beaten by a group of teenagers near their home in Arnhem, in the eastern part of the Netherlands. Since the attack on Sunday, MPs, diplomats and social media users have been joining the protest and posting pictures online in support of the couple:|2017-04-05T14:37:27+0000
http://trib.al/DDzsB9G|It's not that Louis C.K.'s new Netflix special is bad. It's that it could have, and should have, been better. Three stars.|2017-04-04T23:53:11+0000
https://www.facebook.com/GuardianUs/videos/1711793832181010/|Wendy Walsh, one of the women to come forward with sexual harassment claims against Fox News host Bill O'Reilly, says that after she rebuffed advances from O'Reilly she knew retaliation was coming that would hurt her career.|2017-04-03T21:30:00+0000
https://www.facebook.com/GuardianUs/photos/a.1633187976708263.1073741837.456740217686384/1710658975627829/?type=3|Trump saved possibly his most consequential utterance of a day of yet more bickering over healthcare reform and claim and counterclaim over Russia and surveillance for an interview with the Financial Times, in which he said: "Well, if China is not going to solve North Korea, we will." The president would not elaborate, and went on to discuss health reform - which also had an airing on the fairways of Virginia with Senator Rand Paul - Brexit (which he predicted, you know), and the supposed fact that the press "doesn't get" that he and Germany's Angela Merkel actually get on splendidly. Also in foreign policy, UN ambassador Nikki Hayley made aggressive noises about Russian meddling in the US election and said the world was glad the US, under Trump, was leading again. Domestically, Senate majority leader Mitch McConnell promised the confirmation of Neil Gorsuch for the supreme court by the end of the week. He didn't say the words 'nuclear option', but they hung nonetheless over rebellious Democrats. >>> More: http://trib.al/V03dtzr|2017-04-02T22:42:46+0000
https://www.facebook.com/GuardianUs/videos/1707951912565202/|Every second Sunday since Donald J. Trump was elected, groups of women across the country have been holding Solidarity Sundays - activist meet-ups that aim to push back against what they see as harmful policies of the president. We spent time one of the founding groups to learn more about their efforts.|2017-04-02T16:00:00+0000
https://www.facebook.com/GuardianUs/photos/a.456883731005366.123396.456740217686384/1709422752418118/?type=3|Lest anyone focus too closely on the financial information about key White House figures that was released on Friday night, Trump vented spleen over healthcare and surveillance. It was left to one of his aides to spew forth the newsiest statement of an otherwise quiet day. White House social media director Dan Scavino, who has worked for Trump since caddying for him as a teenager, wrote: "@realDonaldTrump is bringing auto plants & jobs back to Michigan. @justinamash is a big liability. #TrumpTrain, defeat him in primary." That would be Justin Amash, a Freedom Caucus representative who stood against the Republican healthcare bill. Amash, an independent-minded type perfectly happy to thumb his nose at the mighty, is also an adept tweeter. "Trump admin & Establishment have merged into #Trumpstablishment," he fired back. "Same old agenda: Attack conservatives, libertarians & independent thinkers." And lo, a simmering Republican civil war did continue in handy, 140-character chunks. More: http://trib.al/V03dtzr|2017-04-01T23:52:07+0000
http://trib.al/OFQexbk|Boss Baby's resemblances to Trump are 'total coincidence', film's director says|2017-04-01T15:53:17+0000
http://trib.al/YfBApGC|Oakland fire officials warned building was 'dangerous' before deadly blaze|2017-04-01T14:45:50+0000
https://www.facebook.com/GuardianUs/videos/1707985852561808/|As the week comes to a close, here's a fascinating timelapse video of an American badger sending a cow to its eternal resting place in the Grassy Mountains of Utah.

(Video via The University of Utah)|2017-03-31T19:51:08+0000
https://www.facebook.com/GuardianUs/videos/660253147495785/|"This is about as serious a transportation crisis as we can imagine," Atlanta mayor Kasim Reed said after a massive fire underneath interstate 85 caused part of the highway to collapse.|2017-03-31T15:15:00+0000
https://www.facebook.com/GuardianUs/videos/1321950517840031/|Mike Flynn in September 2016: "When you're given immunity, that means you've probably committed a crime"
Mike Flynn in March 2017: If you give me immunity, I'll testify|2017-03-31T13:13:56+0000
http://trib.al/VWCNHYx|Burn baby, burn.|2017-03-30T20:11:19+0000
https://www.facebook.com/GuardianUs/videos/1705484012811992/|Hillary Clinton spoke at a conference for businesswomen in San Francisco and criticized male Republican lawmakers for attacking women's healthcare protections and urged voters to "resist, insist, persist and enlist" to combat policies of the Trump administration.|2017-03-29T13:00:00+0000
https://www.facebook.com/GuardianUs/videos/658756624312104/|Adele is almost at the end of her 15-month world tour, which took her through North America, Europe, Australia and New Zealand. Here are some of the 28-year-old singer's most memorable moments from the trip, include getting fans to propose on stage, twerking and bugging out over a beetle.|2017-03-28T15:45:00+0000
http://trib.al/OOXZQVF|Let the countdown begin.|2017-03-27T23:30:02+0000
http://trib.al/3uSTIbY|"It makes no sense to spend the next couple of decades - any project of this magnitude will have to be a long-term fight - simply nibbling away at the edges of a rotten political system instead of building a robust leftwing alternative to it."|2017-03-27T20:27:07+0000
https://www.facebook.com/GuardianUs/videos/1703568893003504/|Donald Trump supporters holding a rally on a popular southern Californian beach clashed with counter-protesters over the weekend.|2017-03-27T16:15:00+0000
https://www.facebook.com/GuardianUs/videos/658285631025870/|Royal Robbins, who died recently, was a pioneer of 'big wall climbing' and a respected voice of the sport. As well as making some of the first ascents of the biggest rock formations in Yosemite Park, Robbins advocated using clean climbing techniques that left no trace on the rock. His achievements and philosophy changed climbing forever.|2017-03-27T13:30:00+0000
https://www.facebook.com/GuardianUs/photos/a.1633187976708263.1073741837.456740217686384/1702835253076868/?type=3|On a second day at Trump National in Virginia, Trump confined himself to one tweet. He was using his blunderbuss, though, writing: "Democrats are smiling in DC that the Freedom Caucus, with the help of Club For Growth and Heritage, have saved Planned Parenthood & Ocare!" There was no mention of Speaker Paul Ryan, who some thought to have been the target of the president's cryptic Fox-focused missive on Saturday. The show Trump wanted people to watch, Judge Jeanine, opened with a call for Ryan to quit. On the Sunday shows, surrogates suggested tax reform could be next while former Freedom Caucus member turned budget czar Mick Mulvaney lamented the actions of his buddies on the hard Republican right. There were also attempts to blame the Democrats for the failure of Ryan's healthcare bill, for not helping gut Barack Obama's signal achievement. Chuck Schumer and Bernie Sanders were, of course, having none of it.  >>> More: http://trib.al/V03dtzr|2017-03-26T22:50:28+0000
https://www.facebook.com/GuardianUs/photos/a.456883731005366.123396.456740217686384/1701669643193429/?type=3|The day after the calamitous collapse of the Republican healthcare reform, Trump ... visited one of his golf clubs. This time it was Trump National in Potomac Falls, Virginia, while wife Melania and son Barron enjoyed the many amenities and pleasant climate of the president's Florida bolthole. It was a quiet day newswise, but the president's thumbs nonetheless twitched, first to tell followers "ObamaCare will explode and we will all get together and piece together a great healthcare plan for THE PEOPLE. Do not worry!" and then to say they should all "Watch @JudgeJeanine on @FoxNews tonight at 9pm". The time-hallowed and weighty demands of government thus met, Trump - and his critics and supporters alike - returned to pondering his response to healthcare defeat. More: http://trib.al/V03dtzr|2017-03-25T23:02:01+0000
https://www.facebook.com/GuardianUs/photos/a.456883731005366.123396.456740217686384/1701371843223209/?type=3|The Republicans on Thursday abandoned a vote on their plans to repeal the Affordable Care Act, as Donald Trump and House speaker Paul Ryan faced rebellion across the House Republican caucus. According to a leadership aide, the scheduled Thursday House vote on the bill was delayed at least for one day as Republicans scramble to find legislation that can achieve a majority within the chamber. Trump, however, seemed initially oblivious as he met with a delegation of truckers at the White House, jumping into the cab of an 18-wheeler to pose for photographs, and telling them the vote was pressing ahead that night. More: http://trib.al/V03dtzr|2017-03-25T17:01:15+0000
http://trib.al/uO7EMIg|"The defendant was motivated purely by hatred. ... This was an act most likely of terrorism," prosecutors noted while asking for charges to be upgraded.|2017-03-24T21:15:06+0000
https://www.facebook.com/GuardianUs/videos/1314604498574633/|Wearing a pin saying 'I love trucks', Trump was busy pumping his fists and giving the air-horn a few blasts. Meanwhile, the Republican healthcare bill was collapsing.|2017-03-24T11:07:10+0000
https://www.facebook.com/GuardianUs/videos/656294951224938/|These teenagers in Baltimore are practicing yoga, meditation and martial arts to help them cope with emotions and control impulse actions. It's part of Project Pneuma, which means 'breath' in ancient Greek, set up to support young black men in overcoming some of the barriers that might hold them back at school.|2017-03-23T14:30:00+0000
https://www.facebook.com/GuardianUs/videos/656324147888685/|Five people have died after a single terrorist staged an attack in central London on Wednesday, killing three members of the public as he careered across Westminster Bridge in a car and stabbing a policeman to death outside parliament. This is how the events unfolded:|2017-03-23T13:18:54+0000
http://trib.al/m8zemei|Wisconsin shootings: four dead after family dispute at bank|2017-03-23T02:40:32+0000
https://www.facebook.com/GuardianUs/videos/1698141303546263/|Muslims working at the FBI have described a culture of suspicion and fear. Said 'Sam' Barodi was fired after he refused to cooperate with customs agents who he believed were targeting him because of his ethnicity and religion. His and other accounts paint a stark picture of the bureau in the era of Trump.|2017-03-22T20:45:35+0000
http://trib.al/MIrt7E3|New travel restrictions placed on flights by foreign-owned airlines from Middle East countries create addition safety hazards for those passengers while giving favorable treatment to US carriers.|2017-03-21T21:31:07+0000
https://www.facebook.com/GuardianUs/videos/1353532924702889/|The growth of China's cities is staggering. This timelapse shows how cities that were barely on the map three decades ago have sprawled in recent years. Watch how China has changed: https://gu.com/p/62f67/us|2017-03-21T17:00:00+0000
http://trib.al/xlp0MUv|'Bank' the turtle dies after swallowing 900 coins thrown by tourists|2017-03-21T09:59:51+0000
http://trib.al/K4o4FBE|Ivanka Trump has West Wing office and will get access to classified information|2017-03-20T23:07:05+0000
https://www.facebook.com/GuardianUs/videos/1695621003798293/|The FBI director, James Comey, has confirmed for the first time that the agency is investigating possible collusion between the Trump campaign and Moscow to influence the outcome of the presidential election. 

The director also said there is no evidence to support a claim by Donald Trump that Trump Tower had been wiretapped during the 2016 campaign.|2017-03-20T17:30:00+0000
https://www.facebook.com/GuardianUs/videos/1695559963804397/|Sea levels are rising. For many cities on the the eastern shores of the United States, the problem is existential. We take a look at how Miami and Atlantic City are tackling climate change, and the challenges they face. Watch: https://gu.com/p/657bj/us|2017-03-20T17:00:00+0000
https://www.facebook.com/GuardianUs/photos/a.1633187976708263.1073741837.456740217686384/1694772770549783/?type=3|In Florida, Trump stayed quiet, emerging from his golf club only to tell reporters on Air Force One, before the flight back to Washington, that North Korean dictator Kim Jong-un was acting "very, very badly". He did not address the German defence minister's rejection of his claims about Nato and debts owed. Elsewhere, backlash to his claims that Barack Obama "wiretapped" Trump Tower continued two weeks after the presidential tweets in question. More: http://trib.al/V03dtzr|2017-03-19T22:19:15+0000
https://www.facebook.com/GuardianUs/photos/a.1633187976708263.1073741837.456740217686384/1692682384092155/?type=3|Donald Trump refused to back down on Friday in the face of British outrage at White House press secretary Sean Spicer's decision to repeat an unsubstantiated claim that British intelligence had spied on the president. Asked about the claim during a joint press conference with Angela Merkel, the German chancellor, Trump said Spicer had only been quoting "a talented lawyer" who had been speaking on Fox News. "We said nothing," argued Trump. "All we did was quote a certain very talented legal mind who was the one responsible for saying that on television." More: http://trib.al/V03dtzr|2017-03-17T22:30:11+0000
https://www.facebook.com/GuardianUs/videos/1692641607429566/|Trump joked about wiretapping during a joint-press conference with Angela Merkel, an apparent reference to reports that the US bugged the German chancellor's phone during Obama's presidency. Meanwhile, the president stood by his unsubstantiated claim that a British intelligence agency spied on him.|2017-03-17T22:15:00+0000
https://www.facebook.com/GuardianUs/videos/653497974837969/|The Dot Watch is the first braille smartwatch, and with more than 100,000 pre-orders expectations are high. But can the watch really be as beneficial to the visually impaired community as the company claims?|2017-03-17T20:00:00+0000
http://trib.al/pGmryAE|Dwayne The Rock Johnson currently has 26 movies in development. Twenty-six. 2-6. A lot, basically.

With this in mind, let's go through his project list on IMDb and take a guess at the plots from the titles alone:|2017-03-17T19:01:30+0000
https://www.facebook.com/GuardianUs/videos/1692440434116350/|This is what it looks like when Donald J. Trump doesn't want to shake hands with a foreign leader.|2017-03-17T18:27:15+0000
https://www.facebook.com/GuardianUs/videos/1692329134127480/|Happy St. Patrick's Day!|2017-03-17T16:10:36+0000
https://www.facebook.com/GuardianUs/videos/10155196450986323/|Charlotte, North Carolina is a 'gateway city' for immigrants, who prop up its construction, health and food industries - not to mention its tax base. If all undocumented workers were to be deported, as the Trump administration is threatening, the consequences could be dire.|2017-03-17T14:00:00+0000
http://trib.al/kslLXXu|Some retreat from their commutes after spotting an undercover police car. Others take a sick day after seeing a Facebook post about an immigration raid. Each week, it becomes easier to imagine what America's cities will look like without undocumented workers.|2017-03-17T12:00:59+0000
https://www.facebook.com/GuardianUs/photos/a.1633187976708263.1073741837.456740217686384/1691563467537380/?type=3|The Republican and Democratic leaders of the Senate intelligence committee have rubbished Donald Trump's incendiary claim that Barack Obama placed Trump Tower under surveillance. "Based on the information available to us, we see no indications that Trump Tower was the subject of surveillance by any element of the United States government either before or after election day 2016," the Republican Richard Burr of North Carolina and the Democrat Mark Warner of Virginia said in a joint statement on Thursday. On Thursday, the White House press secretary, Sean Spicer, challenged the conclusion of the intelligence committees in a combative press conference, in which he insisted there was information of which Congress was not yet aware. More: http://trib.al/ZxVOdnJ|2017-03-16T23:08:28+0000
http://trib.al/j2hWwCb|"Slashing the EPA's overall budget by more than a third means the agency cannot adequately enforce our clean air and clean water safeguards. It is basically a get out of jail free card for polluters."|2017-03-16T20:15:17+0000
http://trib.al/nY2I1Ni|Trump's budget proposes to cut funding for a program aimed at reducing infant and maternal mortality and morbidity.|2017-03-16T19:15:18+0000
http://trib.al/Cdsi3qA|We're guessing Donald J. Trump was not lovin' it.|2017-03-16T16:15:04+0000
http://trib.al/84WxP9A|Is Justin Trudeau a "token feminist"?|2017-03-16T14:15:11+0000
http://trib.al/iEoszeT|Donald Trump appears set on a collision course with federal judges, vowing to fight them to the end after a district court in Hawaii issued the second block in as many months on his proposed travel ban on visitors from majority-Muslim countries.|2017-03-16T13:20:14+0000
http://trib.al/3wmRcJG|A Hawaiian judge took Donald J. Trump's words literally and ruled them unconstitutional.|2017-03-16T12:15:12+0000
http://trib.al/oRkCCKf|In The Library Book, photographer Thomas R Schiff uses a panoramic camera to capture epic pictures of libraries across the US - and these 'reading nooks' are spectacular.|2017-03-15T21:45:12+0000
http://trib.al/d2gsJ3S|Christopher Knight was only 20 years old when he walked away from society, not to be seen again for more than a quarter of a century...|2017-03-15T17:15:06+0000
https://www.facebook.com/GuardianUs/photos/a.1633187976708263.1073741837.456740217686384/1689425074417886/?type=3|The White House was forced to defend its healthcare plan on multiple fronts on Tuesday after a damning report found it would deprive millions of people of insurance, deepening divisions in the Republican party. A nonpartisan Congressional Budget Office (CBO) study released on Monday predicted that by 2026, the number of people without insurance would increase by 24 million if House Republicans' legislation to replace the 2010 Affordable Care Act (ACA) - also known as Obamacare - is adopted. But during an hour-long briefing dominated by the issue, White House press secretary Sean Spicer challenged the CBO's figures, contended that two further phases of reform should be taken into account and continued his retrospective battle with Barack Obama's administration. More: http://trib.al/L0s0fdT|2017-03-14T23:03:29+0000
https://www.facebook.com/GuardianUs/photos/a.1633187976708263.1073741837.456740217686384/1689036617790065/?type=3|As many as 24 million Americans risk losing health coverage over the next decade under the Republican plan to replace the Affordable Care Act, popularly known as Obamacare, the nonpartisan Congressional Budget Office said on Monday. The report predicts a dramatic loss of healthcare coverage over the next decade if Congress enacts the Republican healthcare proposal, which has faced criticism from across the political spectrum and from nearly every sector of the healthcare industry. An estimated 52 million people would be uninsured in 2026, compared with the 28 million who would lack insurance that year under the current law, according to the report. President Donald Trump, who supports the Republican plan, has promised that his plan would provide "insurance for everybody". More: http://trib.al/Lnw1agW|2017-03-14T15:01:40+0000
https://www.facebook.com/GuardianUs/videos/1688274881199572/|Who are the people that get so angry online? Meet the internet warriors, in their own homes. Watch the film: http://trib.al/34Z3igY|2017-03-13T23:30:00+0000
https://www.facebook.com/GuardianUs/photos/a.456883731005366.123396.456740217686384/1688319147861812/?type=3|Read our exclusive interview with Bernie Sanders. He talks about his fight to make the Democratic party more attractive to working-class people - and how he's taking progressive populism to the heartland in order to topple Trump  http://trib.al/VRGHAGe|2017-03-13T22:00:55+0000
https://www.facebook.com/GuardianUs/videos/1688153221211738/|'Despair is not an option': Bernie Sanders shares his advice for young progressives in America.|2017-03-13T21:00:00+0000
http://trib.al/Hwb9Wq7|"We should always be suspicious when machine learning systems are described as free from bias if it's been trained on human-generated data. Our biases are built into that training data."|2017-03-13T20:00:46+0000
https://www.facebook.com/GuardianUs/videos/651603555027411/|Holi is underway, a two-day Hindu festival of color in India and Nepal, where people cover each other with colored powders. The celebrations welcome the coming of spring, but for many it also signifies a fresh start, a time to let go of past sorrows and reconcile long-held grudges.|2017-03-13T19:30:00+0000
https://www.facebook.com/GuardianUs/videos/10155182821676323/|Who are the people that get so angry online? Meet the internet warriors, in their own homes.|2017-03-13T17:30:00+0000
https://www.facebook.com/GuardianUs/photos/a.1633187976708263.1073741837.456740217686384/1688359044524489/?type=3|The president stayed inside the executive residence on his 51st day in office, while emissaries of his White House and the leaders of the Republican party bickered over clashing visions of what healthcare in America should look like. Trump's secretary of health, Tom Price, made a surprising promise that "nobody will be worse off financially" under the new plan. House Speaker Paul Ryan did not deny that people could lose their insurance, but said that would be a choice left to Americans. "But we're not going to make an American do what they don't want to do," he said. "You get it if you want it. That's freedom." Trump's budget director, Mick Mulvaney, said he wasn't sure that a nonpartisan research group charged with evaluating the plan was fit to evaluate it. Opposing the plan were fellow Republicans: senator Tom Cotton said the bill was in part too severe; Ohio governor John Kasich said it cut too many people out of Medicaid; and congressman Mark Meadows said the plan was not extreme enough. Facing off against these divisions were Democrats, itching to fight, and American voters - standing in limbo as their representatives decide the terms of how much it costs to stay healthy. More: http://trib.al/aejLqyu|2017-03-13T22:52:51+0000
http://trib.al/bZLlVa5|Trump supporters in the heartland fear being left behind by GOP health plan|2017-03-12T12:49:56+0000
