https://www.theguardian.com/sport/2017/sep/10/climbing-el-capitan-alex-honnold-yosemite?CMP=fb_us|One man. 
900 meters.
No ropes.

Meet the man who conquered the world's boldest climb.|2017-09-11T21:00:00+0000
https://www.facebook.com/GuardianUs/photos/a.456883731005366.123396.456740217686384/1908559012504490/?type=3|Stop talking right now about the threat of climate change. It's here; it's happening, writes Bill McKibben * https://gu.com/p/779et/us|2017-09-11T20:00:00+0000
https://www.theguardian.com/music/2017/sep/11/juggalos-protest-fbi-label-gang-report-insane-clown-posse?CMP=fb_us|Juggalos consider themselves a family. The FBI considers them a gang. Are these clowns really gang members?|2017-09-11T18:00:00+0000
https://www.theguardian.com/sport/2017/sep/11/sloane-stephens-us-open-tennis-venus-williams?CMP=fb_us|It's not hyperbolic to say American tennis is in the suddenly vibrant state it's in because of black women.|2017-09-11T17:00:00+0000
https://www.theguardian.com/us-news/2017/sep/11/will-khalid-sheikh-mohammed-come-to-trial-9-11-attacks?CMP=fb_us|Will the accused architect of 9/11 ever come to trial?|2017-09-11T16:00:00+0000
https://www.facebook.com/GuardianUs/videos/10155926847916323/|Barack Obama surprised a class at McKinley Tech high school in Washington DC, where he asked students: 'You don't mind me crashing, right?'|2017-09-11T14:06:54+0000
https://www.theguardian.com/world/2017/sep/11/miami-or-mexico-trump-aide-mocked-for-tweeting-video-of-wrong-airport?CMP=fb_us|The president's social media director spread fake news.|2017-09-11T12:30:00+0000
https://www.theguardian.com/world/live/2017/sep/10/hurricane-irma-millions-brace-for-impact-as-superstorm-reaches-florida-live?CMP=fb_us|Follow latest developments as Irma moves up the west coast of Florida.|2017-09-11T12:15:58+0000
https://www.facebook.com/GuardianUs/videos/1907363975957327/|Hurricane Irma has made landfall in Florida with winds of up to 130mph. The 400-mile-wide storm is moving slower than forecast, adding to concerns of deadly flooding.|2017-09-10T17:33:30+0000
http://trib.al/6ipK8VF|Hurricane Irma began a slow passage over Florida on Sunday, lashing low-lying western regions with winds of up to 130mph and threatening record storm surges and flooding which, one of the state's senators said, could represent a "worst-case scenario that meteorologists and emergency planners dread".|2017-09-10T15:19:04+0000
http://trib.al/WJv5TSS|Follow our live blog as Hurricane Irma hits Florida.|2017-09-10T14:31:38+0000
https://www.theguardian.com/us-news/2017/sep/08/us-gun-makers-battle-trump-slump-as-sales-fall-by-100m-compared-to-2016?CMP=fb_us|One set of numbers we doubt Trump will be boasting about|2017-09-08T22:15:00+0000
https://www.theguardian.com/us-news/2017/sep/08/tech-silicon-valley-san-francisco-entrepreneur?CMP=fb_us|Sixth Street is far from the magical land I had read about. Instead, it was littered with trash, glass, and disposed needles, and it reeked of urine. My mother was in horror, trying to convince herself this could not be where she was leaving her precious cargo of 23 years.

"Maybe ... maybe we have the wrong address?" she asked, clearly in denial.

Nope. I was home.|2017-09-08T21:00:00+0000
https://www.theguardian.com/commentisfree/2017/sep/08/does-betsy-devos-care-more-about-those-accused-of-than-its-victims?CMP=fb_us|"As she announced the rollback of Obama-era rules on campus sexual assault, education secretary Betsy DeVos seemed at times less like the head of the Department of Education than the department of rape apologists."|2017-09-08T18:45:00+0000
https://www.facebook.com/GuardianUs/videos/10155916502906323/|George W Bush's presidency never fully recovered from his botched handling of Hurricane Katrina. Barack Obama won re-election just days after Hurricane Sandy struck. So how can presidents respond effectively to natural disasters? And how has Donald Trump managed the response to Harvey and Irma?|2017-09-08T17:22:40+0000
https://www.theguardian.com/technology/2017/sep/07/new-artificial-intelligence-can-tell-whether-youre-gay-or-straight-from-a-photograph?CMP=fb_us|When the software reviewed five images of a person, it could guess their sexuality correctly 91% of the time with men and 83% with women.|2017-09-08T17:15:00+0000
https://www.theguardian.com/us-news/2017/sep/08/congress-hurricane-relief-deal-budget?CMP=fb_us|Bill passed House 316-90 in deal struck between Trump and Democrats|2017-09-08T16:14:57+0000
https://www.theguardian.com/us-news/2017/sep/08/hillary-clinton-memoir-what-happened-election-trump-sanders?CMP=fb_us|It's out on Tuesday and it is already re-opening old wounds among Democrats|2017-09-08T16:10:00+0000
https://www.theguardian.com/world/2017/sep/08/hurricane-irma-harvey-katrina-houston-how-to-rebuild?CMP=fb_us|"When you talk about rebuilding a place like Houston, people's first thoughts are "I want it back the way it was", said Sandra Knight, a senior research engineer at the University of Maryland. "And unfortunately that's not the best thing to do. As a nation we aren't planning forward enough. We are developing in places that aren't sustainable. We need to start doing things differently."|2017-09-08T14:00:00+0000
https://www.theguardian.com/us-news/2017/sep/08/dreamers-daca-jeff-sessions-jobs?CMP=fb_us|"We're not taking jobs away from anybody. When it comes to professional positions like teaching or being a lawyer, a doctor - things like that - those are professions you can't just randomly apply for. It takes years of preparation. We prepared for those jobs."|2017-09-08T12:45:00+0000
https://www.theguardian.com/us-news/2017/sep/08/anaheim-homeless-toilets-confiscated-public-health-crisis?CMP=fb_us|Just 72 hours after the toilets were installed the council of wealthy Orange County insisted the porta-potties be removed from their land|2017-09-08T12:00:00+0000
https://www.theguardian.com/world/2017/sep/08/mexico-earthquake-warning-tsunami?CMP=fb_us|BREAKING NEWS|2017-09-08T05:43:48+0000
http://trib.al/oFHUZ3c|Got a minute?|2017-09-07T23:02:46+0000
https://www.theguardian.com/commentisfree/2017/sep/07/trump-deal-democrats-new-era?CMP=fb_us|Trump shouldn't be praised for cutting this deal, writes Ross Barkan.|2017-09-07T23:00:00+0000
https://www.theguardian.com/environment/2017/sep/07/flash-drought-north-dakota-montana-wildfires?CMP=fb_us|While much of the country's attention has been on hurricanes striking southern Texas and the Caribbean, a so-called "flash drought", an unpredictable, sudden event brought on by sustained high temperatures and little rain, has seized a swathe of the country.|2017-09-07T22:00:00+0000
https://www.theguardian.com/science/2017/sep/07/spacex-us-air-force-shuttle-mission?CMP=fb_us|SpaceX launched the US air force's super-secret space shuttle earlier today.|2017-09-07T21:00:00+0000
https://www.facebook.com/NowThisPolitics/videos/1694000863964730/|Footage of Karen Caudillo's interview with the Guardian and other outlets has gone viral. Read how this young Dreamer is leading the fight against Trump's Daca rollback  https://gu.com/p/76zvg/us|2017-09-07T20:32:37+0000
https://www.theguardian.com/commentisfree/2017/sep/07/donald-trump-dreamer-nightmare?CMP=fb_us|Will Trump reverse his position on Dreamers? It's not inconceivable.|2017-09-07T20:00:00+0000
https://www.theguardian.com/world/2017/sep/07/delta-airlines-plane-flies-puerto-rico?CMP=fb_us|The pilot got more than 170 people out of the path of the most powerful Atlantic hurricane ever recorded.|2017-09-07T16:00:00+0000
https://www.facebook.com/GuardianUs/videos/10155912099546323/|A two-man crew flew straight into the heart of Hurricane Irma in order to gather valuable data on the category five storm. This surreal footage was captured by the National Oceanic and Atmospheric Administration (NOAA).|2017-09-07T14:30:00+0000
https://www.theguardian.com/world/live/2017/sep/07/hurricane-irma-live-latest-updates-caribbean?CMP=fb_us|At least 10 people have died in the wake of Hurricane Irma. Follow the latest developments.|2017-09-07T14:00:00+0000
https://www.theguardian.com/world/2017/sep/07/irma-destruction-island-by-island-hurricane?CMP=fb_us|Irma has ripped through the Caribbean, leaving flattened landscapes, flash floods and loss of life. Here's what we know about the destruction.|2017-09-07T13:45:00+0000
https://www.theguardian.com/world/2017/sep/07/where-is-hurricane-irma-heading-mapping-the-path-of-destruction?CMP=fb_us|These maps and charts track the most powerful storm ever recorded in the Atlantic Ocean as it heads towards Florida.|2017-09-07T13:15:08+0000
https://www.facebook.com/GuardianUs/videos/1487020014666413/|Hurricane Irma, the most powerful Atlantic Ocean hurricane in recorded history, has left parts of the Caribbean "95% destroyed", and is heading towards Florida, where mandatory evacuations have been ordered.|2017-09-07T03:06:26+0000
https://www.facebook.com/GuardianUs/photos/a.456883731005366.123396.456740217686384/1903634956330229/?type=3|Mandatory evacuation orders have been issued in Florida after Hurricane Irma flattened Barbuda and left St Martin "95% destroyed" http://trib.al/vIhs4Ci

The map of zones, for those affected, is here: http://trib.al/CEzxwLc|2017-09-07T02:49:47+0000
https://www.theguardian.com/money/2017/sep/06/us-student-debt-loans-navient-sallie-mae?CMP=fb_us|Instead of fighting inequality, the education industry is reinforcing it. Here's how.|2017-09-06T23:00:00+0000
http://trib.al/Fr71dcH|Get the day's politics news in 60 seconds every weekday.|2017-09-06T22:31:45+0000
https://www.theguardian.com/society/2017/sep/06/narcos-season-three-drug-wars-bank-money-laundering?CMP=fb_us|The war on drugs is seen as a just war against criminal organizations who are at war with us. Our good guys, their bad guys. But here's the problem: it's not true.|2017-09-06T22:00:00+0000
http://trib.al/PtB9ZiH|One week after the record deluge in Texas, the biggest hurricane ever measured in the mid-Atlantic is tearing through the Caribbean.|2017-09-06T21:56:05+0000
https://www.theguardian.com/commentisfree/2017/sep/06/barack-obama-speaking-up-trump-excesses-daca?CMP=fb_us|This country needs all of the good leadership that it can get, writes Daniel Jose Camacho.|2017-09-06T21:00:00+0000
https://www.facebook.com/GuardianUs/videos/10155908703866323/|The first 1,000 days are crucial to a child's early development. Here's how a child's future is determined by the quality of their first years of life.|2017-09-06T18:00:00+0000
https://www.theguardian.com/us-news/2017/sep/06/hillary-clinton-election-trump-bernie-sanders-memoir?CMP=fb_us|In her bombshell new memoir, Hillary Clinton recalls, among other things, the euphoria of her last full day of campaigning. Barack Obama hugged her and whispered, "You've got this. I'm so proud of you." Then in the early hours of 9 November, Obama urged Clinton to concede to Trump, not string things out. The phone call was "one of the strangest moments" of her life.|2017-09-06T16:56:28+0000
https://www.theguardian.com/us-news/2017/sep/05/donald-trump-daca-dreamers-criticism-compassion?CMP=fb_us|Was Trump torn up about ending Daca? "Baloney."|2017-09-06T14:00:00+0000
https://www.theguardian.com/environment/2017/sep/06/plastic-fibres-found-tap-water-around-world-study-reveals?CMP=fb_us|Exclusive: billions of people around the world are drinking water contaminated by plastic particles.|2017-09-06T13:30:00+0000
https://www.theguardian.com/world/live/2017/sep/06/hurricane-irma-caribbean-islands-category-5-storm?CMP=fb_us|Hurricane Irma, the most powerful storm ever recorded over the Atlantic, has made landfall on the tiny Caribbean island of St Martin. Follow live updates.|2017-09-06T12:45:00+0000
https://www.facebook.com/GuardianUs/photos/a.456883731005366.123396.456740217686384/1902999013060490/?type=3|Barack Obama sharply criticized Donald J. Trump's move to strip protections from young undocumented immigrants known as Dreamers. It was Obama's most significant foray in public life since he left the presidency * https://gu.com/p/76f6k/us|2017-09-06T12:20:36+0000
https://www.theguardian.com/us-news/2017/sep/05/hookworm-lowndes-county-alabama-water-waste-treatment-poverty?CMP=fb_us|Exclusive: one of America's darkest and deepest secrets has been revealed. Hidden beneath fabulous wealth, the US tolerates poverty-related illness at levels comparable to the world's poorest countries.|2017-09-06T01:00:00+0000
https://www.theguardian.com/tv-and-radio/ng-interactive/2017/sep/05/what-to-watch-tv-guide-netflix-hulu-amazon-hbo?CMP=fb_us|There's so much to watch, it's intimidating. Here's what's worth your time this fall.|2017-09-06T00:00:00+0000
https://www.facebook.com/GuardianUs/videos/10155905362296323/|Last year we met Arizona residents Belen Sisa and Julio Zuniga: they are among roughly 728,000 undocumented immigrants protected from deportation through an executive order signed by Barack Obama. Now, Donald Trump is to terminate the program and their lives will be plunged into uncertainty.|2017-09-05T23:00:00+0000
https://www.theguardian.com/us-news/live/2017/sep/05/trump-ends-daca-young-immigrants?CMP=fb_us|Catch up on today's politics in 60 seconds [?]|2017-09-05T22:02:00+0000
https://www.theguardian.com/us-news/2017/sep/05/shock-lobster-ghostly-translucent-crustacean-caught-off-maine-coast?CMP=fb_us|This is a whole different kind of see food.|2017-09-05T21:00:00+0000
https://www.facebook.com/GuardianUs/videos/1902046443155747/|Fisherman Alex Todd caught a ghostly, translucent lobster off the Maine coast. He said it was "by far the weirdest one I've caught" in his 40-year fishing career. Todd had to release the lobster as it had a notched tail, indicating it was a female potentially carrying eggs * https://gu.com/p/766mv/us|2017-09-05T17:00:00+0000
https://www.theguardian.com/commentisfree/2017/sep/05/us-shoot-down-north-korea-missile-couldnt-wests-capability?CMP=fb_us|Even the best systems must break at some point.|2017-09-05T16:00:00+0000
https://www.theguardian.com/us-news/2017/sep/05/donald-trump-dreamers-program-young-immigrants?CMP=fb_us|BREAKING NEWS|2017-09-05T15:04:12+0000
https://www.facebook.com/GuardianUs/videos/1485689878132760/|For decades, Ri Chun-hee has been one of the few trusted to inform the people about great moments in North Korea's history. What do we know about her?|2017-09-05T14:30:00+0000
https://www.facebook.com/GuardianUs/videos/1901858009841257/|Fly through Hurricane Irma. States of emergency have been declared as the category four storm heads to the Caribbean.|2017-09-05T14:00:00+0000
https://www.theguardian.com/world/shortcuts/2017/sep/04/north-koreas-pink-lady-the-newscaster-set-to-announce-the-end-of-the-world?CMP=fb_us|The apocalypse will be televised.|2017-09-05T13:00:00+0000
https://www.theguardian.com/us-news/2017/sep/04/hurricane-harvey-landlords-demand-rent-for-flooded-homes?CMP=fb_us|"Our landlords say we have to pay rent and late fees and every day it is going up," Fuentes said. "We are paying rent for somewhere we can't live in. They said 'you aren't the only ones in this situation', but what are we supposed to do? We don't have any money. We don't have anything."|2017-09-05T12:10:20+0000
https://www.theguardian.com/us-news/2017/sep/02/a-uniquely-toxic-figure-donald-trump-faces-extra-hurdles-as-congress-returns?CMP=fb_us|Trump has gone from The Art of the Deal to How to Lose Friends and Alienate People. Now, as Congress returns, he faces a daunting task to get his presidency back on track.|2017-09-05T12:00:00+0000
https://www.theguardian.com/lifeandstyle/2017/sep/04/silicon-valley-ceo-fasting-trend-diet-is-it-safe?CMP=fb_us|Are they crazy?|2017-09-04T21:00:00+0000
https://www.theguardian.com/music/2017/sep/03/john-legend-trump-racism-chrissy-teigen-la-la-land?CMP=fb_us|John Legend on everyday racism, how his wife Chrissy Teigen makes him bolder and why La La Land shouldn't be written off as a white film about jazz.|2017-09-04T19:00:00+0000
https://www.facebook.com/GuardianUs/videos/10155900451261323/|Read what Barack Obama said in his letter for Donald Trump on the day of his inauguration. The letter was published by CNN on Sunday.|2017-09-04T18:00:00+0000
https://www.facebook.com/GuardianUs/videos/10155900455141323/|North Korea's latest nuclear test appears to be its most powerful yet. But how did we get here? And what is driving Kim Jong-un's military aggression?|2017-09-04T17:30:00+0000
https://www.theguardian.com/us-news/2017/sep/02/socialism-young-americans-bernie-sanders?CMP=fb_us|Americans who came of age during the cold war saw socialism being characterized as the close cousin of Soviet communism, and state-run healthcare as a first step to the gulags. There are still those attempting to keep the old scare stories alive.

Then came Bernie Sanders.|2017-09-04T17:00:00+0000
https://www.theguardian.com/science/2017/sep/04/supermassive-black-hole-discovered-near-heart-of-the-milky-way?CMP=fb_us|If confirmed, the black hole will rank as the second largest black hole ever seen in the Milky Way.|2017-09-04T16:00:00+0000
https://www.theguardian.com/world/2017/sep/04/north-korea-nikki-haley-sanctions-nuclear-test-begging-for-war?CMP=fb_us|BREAKING NEWS|2017-09-04T15:30:00+0000
https://www.theguardian.com/world/2017/sep/04/china-what-can-beijing-do-about-north-korea-donald-trump-kim-jong-un?CMP=fb_us|China is "pissed off" about North Korea. Here's what Beijing can do about it.|2017-09-04T15:00:00+0000
https://www.theguardian.com/technology/2017/sep/03/silicon-valley-politics-lobbying-washington?CMP=fb_us|Over the last 10 years, America's five largest tech firms have flooded Washington with lobbying money to the point where they now outspend Wall Street two to one. The tech giants aren't spending this money just to get invited to the best parties - they're doing this to protect their oligopolies.|2017-09-04T13:00:00+0000
https://www.theguardian.com/us-news/2017/sep/03/al-franken-interview-donald-trump-comedy?CMP=fb_us|"I may body-slam you."

Senator Al Franken is joking. Spotting a Guardian reporter, he thinks of the former Republican congressional candidate Greg Gianforte's body slam of the Guardian's Ben Jacobs, and cannot resist the quip. Having surgically removed his funny bone and gone serious, Franken is allowing himself to be funny again.|2017-09-03T21:00:00+0000
https://www.theguardian.com/sport/2017/sep/03/jake-olson-blind-college-football-player-long-snapper-usc-trojans?CMP=fb_us|"It turned out to be a beautiful moment".|2017-09-03T19:00:00+0000
https://www.theguardian.com/us-news/2017/sep/03/we-lost-so-much-but-were-still-here-harvey-robbed-one-young-family-of-their-possessions-but-not-their-hope?CMP=fb_us|Harvey robbed one young family of their possessions, but not their hope.|2017-09-03T18:00:00+0000
https://www.theguardian.com/us-news/2017/sep/02/donald-trump-russia-investigation-obstruction-of-justice?CMP=fb_us|Newly published documents could indicate that the special counsel is looking seriously at whether Donald Trump committed an obstruction of justice on potentially various fronts, legal experts say.|2017-09-03T15:30:00+0000
https://www.facebook.com/GuardianUs/videos/10155896011146323/|This new drone footage shows the scale of flooding in Houston.|2017-09-03T15:00:00+0000
https://www.theguardian.com/world/2017/sep/03/this-north-korean-nuclear-test-means-trump-must-now-start-talks?CMP=fb_us|Donald Trump has tried to convince the public that he has talked tough and now the regime respects him for it. But that is incredibly simplistic, and shows how much learning has to be done to understand what is really going on.|2017-09-03T14:38:52+0000
https://www.theguardian.com/world/2017/sep/03/donald-trump-condemns-very-hostile-north-korea-nuclear-test?CMP=fb_gu|"A rogue nation which has become a great threat."|2017-09-03T13:06:50+0000
https://www.theguardian.com/world/2017/sep/03/north-korean-nuclear-test-confirmed-in-major-escalation-by-kim-jong-un?CMP=fb_gu|BREAKING NEWS|2017-09-03T07:19:37+0000
https://www.theguardian.com/world/live/2017/sep/03/north-korea-nuclear-test-south-korea-yohap-kim-jong-un-live?CMP=fb_us|#BREAKING: South Korea has called a national security meeting after an earthquake of magnitude 6.3 was detected near a North Korean testing area. Follow our coverage live.|2017-09-03T04:51:07+0000
https://www.theguardian.com/news/2017/aug/31/the-last-nazi-hunters?CMP=fb_us|Did you know that there is a department of the German government still hunting the last living Nazis?|2017-09-02T14:00:00+0000
https://www.theguardian.com/technology/2017/sep/01/juicero-silicon-valley-shutting-down?CMP=fb_us|Squeezed out.|2017-09-01T23:00:00+0000
https://www.facebook.com/GuardianUs/photos/a.456883731005366.123396.456740217686384/1897491190277939/?type=3|Hurricane Harvey has recorded a maximum rainfall of 51.88 inches (the US record is 52 inches during a cyclone in 1950). Trump came to see the devastation and said, "what a crowd, what a turnout". Here's some perspective. 

Source: National Weather Service. 
Illustration: Mona Chalabi * instagram.com/monachalabi|2017-09-01T22:00:00+0000
https://www.theguardian.com/us-news/2017/sep/01/slave-block-fredericksburg-virginia?CMP=fb_us|The slave block is not a manmade creation to honor history; it is history. There is no question over the interpretation of the block - it is a living symbol of hate. The question is what to do with all of this.|2017-09-01T21:00:00+0000
https://www.theguardian.com/commentisfree/2017/sep/01/penelope-gazin-kate-dwyer-women-sexism?CMP=fb_us|"It would take me days to get a response, but Keith could not only get a response and a status update, but also be asked if he wanted anything else or if there was anything else that Keith needed help with." Imagine that.|2017-09-01T18:00:00+0000
https://www.theguardian.com/technology/2017/sep/01/apple-iphone-redesign-10th-anniversary-launch-event-12-september-tim-cook-steve-jobs-theater?CMP=fb_us|Will the new iPhone come with wireless charing? Here's what to expect from Apple's latest redesigns.|2017-09-01T17:00:00+0000
https://www.theguardian.com/science/2017/sep/01/paolo-macchiarini-scientist-surgeon-rise-and-fall?CMP=fb_us|Scientific pioneer, superstar surgeon, miracle worker - that's how Paolo Macchiarini was known for several years. Dressed in a white lab coat, with his broad, handsome face and easy charm, he certainly looked the part. And fooled almost everyone.|2017-09-01T16:00:00+0000
https://www.theguardian.com/commentisfree/2017/aug/31/ivanka-trump-womens-rights-wage-gap?CMP=fb_us|This week the Trump administration scrapped a policy that was designed to tackle the wage gap. Ivanka was a willing sidekick in the endeavor, writes Jessica Valenti.|2017-09-01T13:38:29+0000
https://www.theguardian.com/us-news/2017/aug/31/hurricane-harvey-lost-pets-rescue-effort?CMP=fb_us|There aren't a lot of good moments in the midst of tragedy, but seeing pets reunited with their people is one.|2017-08-31T23:00:00+0000
https://www.theguardian.com/world/2017/aug/31/far-right-alt-right-white-supremacists-rise-online?CMP=fb_us|It wasn't meant to be like this. The beginning of the internet was full of hope: limitless information would make us wiser, kinder, less bigoted. When did hate get a foothold?|2017-08-31T22:00:00+0000
https://www.theguardian.com/us-news/2017/aug/31/trump-russia-inquiry-paul-manafort-felix-sater?CMP=fb_us|All eyes have been on Hurricane Harvey this week but there were potentially significant developments in the Trump-Russia investigation. Here's what you missed.|2017-08-31T21:00:00+0000
https://www.facebook.com/GuardianUs/videos/10155883299096323/|Rescue operations are continuing across Texas to save people stranded by Harvey.|2017-08-31T16:30:00+0000
https://www.theguardian.com/us-news/2017/aug/31/georgia-police-officer-we-only-shoot-black-people?CMP=fb_us|"Remember, we only kill black people."|2017-08-31T15:00:00+0000
https://www.facebook.com/GuardianUs/videos/10155882646211323/|Was Bad Michael Jackson's best achievement?|2017-08-31T14:00:00+0000
https://www.theguardian.com/us-news/2017/aug/30/lakewood-church-joel-osteen-hurricane-harvey?CMP=fb_us|What took so long?|2017-08-31T13:00:00+0000
https://www.theguardian.com/us-news/2017/aug/31/explosions-flooded-texas-chemical-plant-arkema-crosby?CMP=fb_us|Breaking: Two explosions have taken place at a chemical plant in Crosby, Texas, that lost power due to flooding caused by tropical storm Harvey.|2017-08-31T12:16:11+0000
https://www.theguardian.com/commentisfree/2017/aug/30/taylor-swift-snake-woman-misogyny-look-what-you-made-me-do?CMP=fb_us|Taylor Swift is not the first snake woman. Since the Old Testament, society has sought to discredit and vilify women by associating them with the scaly and the slithering.|2017-08-30T23:00:00+0000
https://www.theguardian.com/us-news/2017/aug/30/starbucks-coffee-paid-parental-leave?CMP=fb_us|Are you a barista or a boss? At Starbucks, your maternity leave depends on it.|2017-08-30T22:00:00+0000
https://www.facebook.com/GuardianUs/videos/1894994343860957/|The Bowers Civic Center in Port Arthur, Texas was overwhelmed by flood water from storm Harvey, forcing about 100 weary people to retreat to bleacher seats with their belongings.|2017-08-30T18:00:00+0000
https://www.facebook.com/GuardianUs/photos/a.456883731005366.123396.456740217686384/1894898953870496/?type=3|Cartoonist Ben Jennings on Trump and tropical storm Harvey * https://gu.com/p/75bcj/us|2017-08-30T17:00:00+0000
https://www.theguardian.com/commentisfree/2017/aug/30/houston-megachurch-shut-out-flood-victims-twitter-storm?CMP=fb_us|Joel Osteen's church holds 16,000 people, but instead of opening his doors to Harvey victims he tweeted out good thoughts. Then he was told: that's not what Jesus would do.|2017-08-30T16:00:00+0000
https://www.theguardian.com/world/2017/aug/30/north-koreas-kim-jong-un-says-missile-launch-a-prelude-to-containing-guam?CMP=fb_us|Trump on North Korea: 
