https://www.facebook.com/GuardianUs/videos/1871996119494113/|North Korea has threatened and attack on the US territory of Guam and Donald Trump has threatened North Korea with "fire and fury" - but everything's fine. That's the message secretary of state Rex Tillerson gave in an effort to downplay the pending threat of a unfathomable nuclear war.|2017-08-09T19:35:00+0000
https://www.facebook.com/GuardianUs/videos/10155796018071323/|The Zero Per Cent Club is an exclusive list of the worst films of all time. You'd be surprised at the titles that haven't gained entry. Which films do you think should have made the list?|2017-08-09T17:00:00+0000
https://www.theguardian.com/us-news/2017/aug/07/california-police-officer-passenger-gun-video?CMP=fb_us|The video shows the passenger hold up his hands and explain that he was looking for the requested documents, noting the papers on the floor and asking why the officer is pointing the weapon at him.|2017-08-07T21:32:14+0000
https://www.facebook.com/GuardianUs/videos/10155788701766323/|Do ruff seas make for good surfers? The world dog surfing championships are back!|2017-08-07T20:00:00+0000
https://www.facebook.com/GuardianUs/photos/a.456883731005366.123396.456740217686384/1869274273099631/?type=3|The Guardian view on sanctions: an essential tool ... but in Trump's hands they are blunted by political problems of his own making. Read the editorial: https://gu.com/p/7xt7g/us|2017-08-07T13:30:00+0000
http://trib.al/hleps4L|The window on Colin Kaepernick's NFL career may well be slamming shut|2017-08-07T11:16:58+0000
http://trib.al/TWsov5N|Football world watches as MLS rolls out video replays leaguewide|2017-08-07T09:11:48+0000
https://www.facebook.com/GuardianUs/photos/a.456883731005366.123396.456740217686384/1866193506741041/?type=3|Guardian cartoonist Martin Rowson on Trump's Russia links. This week, the president blasted the Russia investigation as news emerged that special counsel, Robert Mueller, has convened a grand jury in the case. Read more: http://trib.al/9rsW7PQ|2017-08-04T21:30:36+0000
http://trib.al/Qg3JGCM|Sorry, bro.|2017-08-04T19:01:59+0000
https://www.facebook.com/GuardianUs/photos/a.456883731005366.123396.456740217686384/1866029263424132/?type=3|This week, government documents revealed Trump is trying to undo affirmative action at universities. Mona Chalabi, our data editor, explains the impact this could have based on previous reversals: "Several states have banned affirmative action programs in the past - it happened in California in 1998 and when it did, black and hispanic enrollment at Berkeley fell from 24% to just 13%. Since then, the gap between a fair world and the real one has got even wider." Source: National Center for Education Statistics, US Census Bureau

Read the full story: http://trib.al/nSoUSZd|2017-08-04T18:30:52+0000
http://trib.al/HRmx9Gj|"America's addiction to cheap meat, fed on corn and soy in vast indoor factories, comes at a high cost in human health problems and environmental destruction."|2017-08-04T17:01:20+0000
https://www.facebook.com/GuardianUs/videos/10155776857341323/|Dearborn, Michigan has been thrown into conflict. It's home to one of America's oldest Muslim communities, but also right-wing militias, anti-Muslim rhetoric, and rapid industrial decline. Can this divided city grapple with what it means to be American?|2017-08-04T16:30:00+0000
https://www.facebook.com/GuardianUs/videos/722087154645717/|James Baldwin would have been 93 today. Here's the writer, essayist, poet and civil rights activist debating whether the 'American dream' has been achieved at the expense of African-Americans.|2017-08-02T21:00:00+0000
http://trib.al/GYYpVIg|The Boy Scouts: "We are unaware of any such call."
Mexico's foreign relations department: "[Pena Nieto] has not had any recent telephone communication with Trump".|2017-08-02T17:30:20+0000
https://www.facebook.com/GuardianUs/videos/1453198261381922/|Bernie Sanders took an opportunity on the floor of the Senate to point one instance in which Donald Trump has been right in his assessment of healthcare: "Australia has better healthcare than we do."

Here's why.|2017-08-01T23:00:00+0000
https://www.facebook.com/GuardianUs/photos/a.456883731005366.123396.456740217686384/1862285673798491/?type=3|Editorial: The president embraces disruption. Now a new chief of staff promises to impose discipline. But the real problem is his boss - and those enabling him. http://trib.al/sPjAbPB|2017-08-01T20:01:10+0000
http://trib.al/UOhd72q|Naturally, the Game of Thrones creators' idea to follow up their fantastical juggernaut with an alt-history project - one that's been ridiculed as a gratuitously speculative take on this country's bloodstained past, the stuff of white supremacist wet dreams - made the pair a lightning rod for widespread rebuke.|2017-08-01T17:00:47+0000
https://www.facebook.com/GuardianUs/videos/1862053393821719/|Donald Trump Jr. has admitted meeting a Russian lawyer he was told could help to damage Hillary Clinton's presidential campaign. Now reports suggest the president dictated his son's initial statement about the meeting - which was misleading and inaccurate.|2017-08-01T15:30:00+0000
https://www.facebook.com/GuardianUs/videos/10155765830566323/|A week can be a long time in politics, even more so if you're working for Donald Trump. We look back at the rise and fall of The Mooch.|2017-08-01T12:13:30+0000
https://www.facebook.com/GuardianUs/photos/a.456883731005366.123396.456740217686384/1861384423888616/?type=3|Nasty, brutish and short. These are the key departures in the first six months of Donald Trump's presidency: http://trib.al/K1iO5In|2017-07-31T22:30:13+0000
http://trib.al/10uwZ0F|The Smooch of Death.|2017-07-31T19:15:26+0000
http://trib.al/t9xMbS3|"Randy Bryce is an army veteran and cancer survivor, he belongs to Iron Workers Local 8. He's a proud Democrat and union man in a state that is run by Republicans who fight for labor conditions that would make an oligarch in Charles Dickens's England proud."|2017-07-31T18:30:03+0000
https://www.facebook.com/GuardianUs/photos/a.456883731005366.123396.456740217686384/1860999320593793/?type=3|The sense of things falling apart in Washington is palpable. Read our editorial on Trump's unfitness for office: http://trib.al/OkYqvgz|2017-07-31T15:00:17+0000
http://trib.al/TpoIyFq|Venezuela poll: EU condemns violence as turnout figure disputed|2017-07-31T12:01:54+0000
http://trib.al/ddQn4z6|'No more brilliant jerks' - Arianna Huffington ushers in the new Uber|2017-07-30T18:29:53+0000
http://trib.al/zDufnzZ|As women's sport grows, athletes find they can't stay silent in the era of Trump|2017-07-29T20:01:24+0000
http://trib.al/AzdpZkR|Activists refuse to slow resistance after stymying Republican healthcare plan|2017-07-29T18:40:36+0000
http://trib.al/KuqLeAz|'Don't be too nice': Trump seems to back rougher policing in immigration speech|2017-07-28T20:19:09+0000
https://www.theguardian.com/lifeandstyle/2017/jul/28/alec-baldwin-actor-donald-trump-impersonator-work-family?CMP=fb_us|Alec Baldwin talks about the expectations of being the eldest of his brothers, how he and his sisters were turned into the household staff and the delights of working less to be at home more|2017-07-28T16:30:00+0000
https://www.theguardian.com/commentisfree/2017/jul/27/anthony-scaramucci-donald-trump?CMP=fb_us|The Mooch is clearly a genius of communications, and Donald Trump deserves nothing less, writes Richard Wolffe.|2017-07-28T15:30:00+0000
https://www.theguardian.com/us-news/2017/jul/28/obamacare-trump-implode-healthcare-bill?CMP=fb_us|What happens to Obamacare now?|2017-07-28T15:00:00+0000
https://www.facebook.com/GuardianUs/videos/1857557157604676/|Enter 'The Mooch'. Meet the new head of communications for the White House.|2017-07-28T14:00:00+0000
https://www.theguardian.com/us-news/2017/jul/27/donald-trump-transgender-ban-troops-pentagon-us-military?CMP=fb_us|America's top military official said armed forces would continue to permit transgender people to serve openly until Defense Secretary Jim Mattis has received Trump's "direction" to change the policy and figured out how to implement it.|2017-07-27T17:00:00+0000
https://www.facebook.com/GuardianUs/videos/10155747104351323/|'We're better than this': Trump's decision to ban transgender people from serving in the military has sparked protests. Likewise, transgender veterans have condemned the move as a step away from equality.|2017-07-27T16:30:00+0000
https://www.facebook.com/GuardianUs/videos/1855260321167693/|'You deserve better': Joe Kennedy, chair of the transgender equality task force, criticized Trump's decision to not allow trans people to serve in the US military.|2017-07-26T20:13:31+0000
https://www.facebook.com/GuardianUs/videos/10155742897941323/|Can you tell the real Obama from the fake Obama? New video and audio tools can create false footage that appears so realistic you can hardly tell the difference. So, what does this mean for the future of fake news?|2017-07-26T18:00:00+0000
https://www.theguardian.com/us-news/2017/jul/25/donald-trump-speech-boy-scouts-jamboree?CMP=fb_us|Donald J. Trump: "Who the hell wants to talk about politics when I'm in front of the Boy Scouts?" Trump then went on to talk about politics in front of the Boy Scouts.|2017-07-25T13:30:00+0000
https://www.facebook.com/GuardianUs/videos/10155737788146323/|Trump addressed the Boy Scouts at their jamboree last night. He came armed with a prepared speech and he declared he would not talk about politics. Then, predictably, he went off-script to talk about some favorite topics. And politics.|2017-07-25T12:02:43+0000
https://www.facebook.com/GuardianUs/videos/10155734211741323/|Watch Michael Phelps race a great white shark (sort of).|2017-07-24T17:00:00+0000
http://trib.al/X0APzvc|Reince Priebus is 'furious'. Steve Bannon is 'livid'. And Sean Spicer is out. 
Catch up on Friday's politics news in 60 seconds.|2017-07-21T22:00:35+0000
http://trib.al/7bMO1Jx|It began like a hurricane and ended exactly half a year later, petering out like a drizzle of rain.|2017-07-21T18:00:08+0000
https://www.facebook.com/GuardianUs/videos/1848339188526473/|Sean Spicer has resigned as White House press secretary. Even though his tenure was short, he made some lasting memories.|2017-07-21T17:00:00+0000
http://trib.al/gsI0y8z|It was, to say the least, an uneven tenure.|2017-07-21T16:10:16+0000
http://trib.al/Aak93gP|Yes, we know.|2017-07-21T15:30:30+0000
https://www.facebook.com/GuardianUs/videos/1846901585336900/|As Donald J. Trump falters six months into his presidency, supporters in a Pennsylvania county that swung Republican in 2016 blame the media for his woes and insist Hillary Clinton would be worse.|2017-07-21T00:30:00+0000
http://trib.al/TE8g6no|Chester Bennington's cleanly articulated tales of emotional struggle gave millions the sense that someone understood them, writes our music editor, Ben Beaumont-Thomas.|2017-07-20T22:00:12+0000
https://www.facebook.com/GuardianUs/videos/1847064621987263/|Here's how Donald J. Trump really feels about Jeff Sessions.|2017-07-20T17:55:06+0000
http://trib.al/5WZ4x6A|We're six months into Donald J. Trump's presidency. His most staunch supporters still have his back, don't care about Russia and are pointing the finger elsewhere.|2017-07-20T11:58:51+0000
https://www.facebook.com/GuardianUs/videos/10155713582836323/|Zombies are everywhere these days. But it was the late filmmaker George A Romero who was the first to make them into flesh-eating corpses, and with his influential Living Dead series, helped popularize the idea of bringing horror monsters into everyday life.|2017-07-19T19:00:00+0000
https://www.facebook.com/GuardianUs/videos/1440953269273088/|Three weeks before Australian yoga teacher Justine Damond was shot dead by police in Minneapolis, she rescued an entire family of ducklings from a sewer near her home: "There was this moment when I think they realised I was there to help and they just started jumping to my lap, I was in bliss!"|2017-07-19T14:30:00+0000
https://www.facebook.com/GuardianUs/videos/10155704684046323/|"When you restrict access to abortion, people die."

We traveled to Texas, the frontline of America's abortion battle, to uncover how misinformation, religion and legal fights are leaving women's healthcare hanging by a thread|2017-07-17T16:00:00+0000
http://trib.al/5mt54YU|Revenue for Walt Disney theme parks was $16.9 billion in 2016. That was up 5 percent from $16.1 billion in 2015.|2017-07-17T15:30:16+0000
http://trib.al/HNKM4Hk|Jodie Whittaker is the Doctor we deserve.|2017-07-17T15:00:48+0000
http://trib.al/NJiYCHd|How Venus Williams roared back at 37: diet, brains and bloody mindedness|2017-07-17T08:30:00+0000
http://trib.al/z75NAxI|Trump regrets 'bizarre mistake' of Paris climate pullout, Branson claims|2017-07-15T15:40:15+0000
http://trib.al/VQCYsNU|A year on, families of 'martyrs' who resisted Turkey coup count cost|2017-07-15T05:33:16+0000
https://www.facebook.com/GuardianUs/videos/10155691136681323/|Was Trump V Macron the US president's longest and most determined handshake?|2017-07-14T17:00:00+0000
https://www.facebook.com/GuardianUs/videos/1435800139788401/|"She's in such good physical shape. Beautiful". Donald J. Trump's creepy comment about Brigitte Macron, France's first lady.|2017-07-14T12:30:00+0000
http://trib.al/1qpl83H|Do you want fries with that?|2017-07-13T19:00:37+0000
https://www.facebook.com/GuardianUs/videos/10155686228996323/|Police pulled over Florida's first and only black state attorney - and then seemed to struggle to explain why.|2017-07-13T17:30:00+0000
https://www.facebook.com/GuardianUs/videos/1835907409769651/|With smoking in decline in much of the developed world, tobacco companies are putting their hopes in new markets where populations are growing quickly and regulations can still be strong-armed in the courts. A new investigative series from The Guardian looks at how big tobacco has survived death and taxes to remain a booming, deadly business.|2017-07-12T16:31:00+0000
https://www.facebook.com/GuardianUs/videos/10155681724756323/|A trillion-tonne iceberg has broken off an ice shelf on the Antarctic peninsula and is now adrift in the Weddell Sea.|2017-07-12T15:00:00+0000
http://trib.al/xsZtxvB|Trump Jr probably believes the talking points he trotted out in his interview with Sean Hannity. The Republican Party, however, cannot claim similar ignorance, writes Walter Shapiro.|2017-07-12T13:00:33+0000
http://trib.al/xBSa7Fm|A question Sean Hannity could have asked Donald Trump Jr.: Why did you not report this potential subversion of US democracy by a foreign adversary to the FBI?|2017-07-12T12:12:55+0000
https://www.theguardian.com/us-news/live/2017/jul/11/russia-ties-donanld-trump-jr-meeting-trump-news?CMP=fb_us|Got a minute? Catch up on Tuesday's politics news in just 60 seconds[?]

Here's a summary: [?][?][?][?][?][?]|2017-07-11T23:00:00+0000
https://www.facebook.com/GuardianUs/photos/a.456883731005366.123396.456740217686384/1834919156535143/?type=3|Here are some of the dots that connect Donald Trump's campaign and Russia. And here's why Donald Trump Jr.'s meeting with a Russian lawyer is so significant: http://trib.al/6sYnuhQ|2017-07-11T20:05:07+0000
https://www.facebook.com/GuardianUs/videos/1833252693368456/|Will Trump's "gun strike force" stop violence in Chicago? The message time and again from people with first-hand knowledge of the problems was that Trump's solution of "sending in the feds" was not helpful.|2017-07-10T22:00:00+0000
http://trib.al/nBv6gp9|Google's search box - the modern day confessional.|2017-07-10T14:31:04+0000
https://www.facebook.com/GuardianUs/videos/1431897796845302/|Donald J. Trump actually posted this powerpoint-esque video of his and Ivanka's 'highlights' at G20 and it is ... something to behold. Sing along if you know the words ...|2017-07-10T12:30:00+0000
https://www.facebook.com/GuardianUs/videos/1430990760269339/|"He has no desire and no capacity to lead the world" - Australian journalist Chris Uhlmann unleashed savage analysis of Trump's presidency and his "lonely, awkward" performance at the G20 summit.|2017-07-09T14:29:22+0000
http://trib.al/xXrTpac|Amanda Nunes hospitalized a few hours before UFC 213 title defense|2017-07-08T22:53:51+0000
https://www.facebook.com/GuardianUs/videos/10155662329461323/|High school students from Democracy Prep school in the South Bronx, New York, compete against young people across the US at a 'speech' competition at Yale University - a form of competitive acting. It's not only trophies at stake, this could be their only chance of a college scholarship.|2017-07-08T16:00:00+0000
https://www.facebook.com/GuardianUs/videos/709101205944312/|China appears to be turning over a new leaf by introducing greener energy policies. Will it be the first superpower to go green?|2017-07-08T15:00:00+0000
http://trib.al/Rx7ili4|Seven right whales found dead in 'devastating' blow to endangered animal|2017-07-08T13:42:41+0000
http://trib.al/tr1bSpD|US bourbon producers warn of financial damage if EU retaliates to Trump threat|2017-07-08T12:15:37+0000
http://trib.al/tjP5erP|Literally.|2017-07-07T21:00:35+0000
https://www.facebook.com/GuardianUs/videos/10155661827666323/|'It's an honor to be with you" - Trump to Putin as they hold their first official meeting at the G20 summit.|2017-07-07T17:00:00+0000
https://www.facebook.com/GuardianUs/videos/10155661642131323/|Watch Naomi Klein on how Trump's "mental instability, out-of-control ego and general man-babyness" is being used by the Republican party to distract from their damaging policies.|2017-07-07T16:30:00+0000
https://www.facebook.com/GuardianUs/videos/708530612668038/|For Farc rebels, raising a child would have been incompatible with life as a guerrilla fighter because of a 52-year pregnancy ban. But now that a peace deal has been signed with the government couples are finally allowed to become parents.|2017-07-07T13:00:00+0000
https://www.facebook.com/GuardianUs/videos/10155661127856323/|Vladdy, is that you?|2017-07-07T12:35:51+0000
http://trib.al/J1u21ZU|The departure means Donald Trump will appoint his own nominee to oversee the Office of Government Ethics.|2017-07-06T19:00:20+0000
https://www.facebook.com/GuardianUs/videos/10155653103681323/|Sex robots are no longer science fiction. The first robots, with animatronic movement and artificial intelligence, are due to go on sale by the end of the year. We visited a lab in San Diego that says its creating "the future of sex." Meet the people who are making sex robots, the customers who want to buy them, and the critics who say they are dangerous.|2017-07-06T01:00:00+0000
https://www.facebook.com/GuardianUs/videos/10155653491356323/|Naomi Klein joined us on the latest episode of our books podcast. The activist and author speaks about her new book, No is Not Enough, and the importance of finding a way to push back against the shock politics of the Trump administration. You can also listen here: https://gu.com/p/6n2cv/us|2017-07-05T23:30:00+0000
http://trib.al/N0D0L57|Looks like scientists have cracked the secret of Roman concrete.|2017-07-04T21:01:52+0000
https://www.facebook.com/GuardianUs/videos/1824210404272685/|Trump's anti-CNN tweet is his latest attack on the media in recent days.|2017-07-03T20:30:00+0000
https://www.facebook.com/GuardianUs/videos/1824101820950210/|  Buzz Aldrin reacted with a range of expressions while Donald Trump made a speech about the importance of exploring space.|2017-07-03T18:45:00+0000
http://trib.al/d8WcNrh|"While many people think of Canada as a vast expanse of snowy wilderness, 75% of Canadians actually live within 90 minutes of the US border - which they desperately cling to for warmth and television shows."|2017-07-03T17:45:05+0000
http://trib.al/DSFlyTe|Donald Trump has promised to "unleash" American fossil fuels.|2017-07-03T14:45:03+0000
http://trib.al/9lNRU0r|'I have the right to be here': becoming an American under a Trump presidency|2017-07-02T10:45:05+0000
http://trib.al/3yJcxhj|Tower of human skulls found in Mexico City dig casts light on Aztec sacrifices|2017-07-01T20:31:07+0000
http://trib.al/QyFCHN7|Promoter in failed Bahamas Fyre music festival arrested in New York|2017-07-01T19:10:51+0000
http://trib.al/cYqE4yC|'I don't think it's civil to kill people': rage continues over Republican health bill|2017-07-01T17:06:32+0000
https://www.facebook.com/GuardianUs/videos/1819211171439275/|An elk on a golf course, a bear on a football pitch, a stray dog on stage with an orchestra. It must be Friday.|2017-06-30T17:00:00+0000
http://trib.al/fqD7W7a|Golden Globe and Oscar winner Annie Lennox may finally get her big break.|2017-06-30T15:30:41+0000
http://trib.al/1vdUiBT|Have museums and raves found a way to live side by side?|2017-06-29T19:00:56+0000
https://www.facebook.com/GuardianUs/videos/704893253031774/|A million plastic bottles are bought every minute across the world and, despite the rise in recycling culture over the past few decades, just 7% of plastic bottles collected last year were actually turned into new ones. Plastic waste in the sea is set to outweigh fish by 2050, so why aren't drinks companies doing more to reduce their impact on the environment?|2017-06-29T17:30:00+0000
http://trib.al/BAl7mEA|Trump attacked the hosts of Morning Joe, making an especially crude reference to anchor Mika Brzezinski "bleeding badly" from a facelift. Brzezinski herself responded on Twitter with an image that appeared to mock the size of the president's hands.|2017-06-29T14:47:16+0000
http://trib.al/Z4HTjh4|Get up to speed on the Republican healthcare bill. Here's what you need to know.|2017-06-29T13:00:37+0000
https://www.facebook.com/GuardianUs/photos/a.1816055238421535.1073741838.456740217686384/1816055245088201/?type=3|It's been revealed that Donald Trump has a fake TIME magazine cover hanging in several of his golf clubs around the country. Odd, right? Well, TIME has asked the president to take them down so we wanted to offer up some additional magazine wall art with covers, like the adoring TIME one, that were never actually printed. You can read more about this strange sense of decor here: http://trib.al/7KZw68m|2017-06-28T19:54:45+0000
https://www.facebook.com/GuardianUs/videos/1815832678443791/|Deep-sea mining appears inevitable as we hunt for the vast treasure of untouched resources on the ocean floor. But this emerging technology could forever scar the landscape of the sea.|2017-06-28T18:00:00+0000
https://www.facebook.com/GuardianUs/videos/10155621066546323/|Trump had a bizarre exchange with a reporter during a phonecall with Ireland's newly-elected prime minister.|2017-06-28T15:02:00+0000
https://www.facebook.com/GuardianUs/videos/1814784715215254/|The tension between the news media and the Trump administration is seemingly ever escalating, resulting in scenes like this one from the White House press briefing Thursday. Deputy press secretary Sarah Huckabee Sanders was called out by a reporter for her use of the term "fake news" when describing legitimate news organizations.|2017-06-27T21:41:31+0000
http://trib.al/grMe8u6|Serena Williams to John McEnroe: "Respect me and my privacy as I'm trying to have a baby. Good day sir."|2017-06-27T13:00:19+0000
http://trib.al/eObthXO|Yes, Google was doing this.|2017-06-26T20:30:54+0000
http://trib.al/Btt1nRZ|"If the federal government refuses to act or is just paralyzed, the cities themselves, through their mayors, are going to create a new national policy by the accumulation of our individual efforts."|2017-06-26T18:30:46+0000
https://www.facebook.com/GuardianUs/videos/10155612071661323/|The ASMR videos that give YouTube viewers 'head orgasms'.|2017-06-26T17:30:00+0000
https://www.facebook.com/GuardianUs/videos/701566553364444/|There's enough food to go round, yet 11% of the world's population goes to bed on an empty stomach. World leaders have promised to end hunger by 2030. But what causes it and how do we prevent it?|2017-06-24T00:00:00+0000
https://www.facebook.com/GuardianUs/videos/1809692945724431/|This aerial footage shows the split in Antartica's Larsen C ice shelf, taken at the start of the year. As a rift on the Larsen C lengthens and gets closer to the ice front, we are anticipating the detachment of a large tabular iceberg within the next few weeks. Glaciologists have cautioned not to be alarmed about this, though, saying this is part of a natural process and not related to climate change.|2017-06-23T20:30:00+0000
https://www.facebook.com/GuardianUs/videos/10155600757136323/|How does it feel to be on top of the world? We asked Kilian Jornet, widely considered to be the world's best ultra-distance and mountain runner.|2017-06-23T18:00:00+0000
https://www.facebook.com/GuardianUs/videos/1809550625738663/|Police in California are asking for witnesses to come forward after a motorcyclist kicked a car while traveling at along a freeway in Santa Clarita. The incident ended in a pile-up which left one person injured.|2017-06-23T16:30:00+0000
https://www.facebook.com/GuardianUs/videos/1808280995865626/|Could a key part of solving Hawaii's homelessness problem actually come from its homeless citizens?

With barely enough shelter to house even a fraction of the homeless people on its main island, one group of homeless Hawaiians has taken matters into their own hands, forming a highly organized and self-sustaining community.|2017-06-23T00:00:00+0000
http://trib.al/FZFNhYl|Barack Obama has attacked the Republican healthcare bill: "The bill, unveiled today, is not a healthcare bill. It's a massive transfer of wealth from middle-class and poor families to the richest people in America."|2017-06-22T21:32:10+0000
http://trib.al/9Wd6nHF|The Lannisters send their regards.|2017-06-22T20:30:47+0000
