id||pub_date||link||headline||par1
3030||2017-06-10||http://www.breitbart.com/video/2017/06/10/trump-infrastructure-think-big-america-going-build/?utm_source=facebook&utm_medium=social||Trump on Infrastructure: Think Big ” America Is Going to Build Again||In his weekly address, President Donald Trump made a pitch for his infrastructure agenda and insisted the country was going to build again under budget and ahead of schedule.
3055||2017-06-09||http://www.breitbart.com/big-hollywood/2017/06/09/salma-hayek-trump-supporters-thought-process-scares-me/?utm_source=facebook&utm_medium=social||Trump Critic Salma Hayek Wants to Understand the Rest of America||Actress Salma Hayek has been relentlessly bashing Donald Trump for nearly two years and although she says the political views of Trump supporters are frightening to her, her latest movie role has inspired her to seek better understanding of her fellow Americans.
3061||2017-06-09||http://www.breitbart.com/big-government/2017/06/09/trump-empowers-states-with-massive-permitting-reform-in-first-step-to-renewing-americas-roads-rails-runways-and-rivers/?utm_source=facebook&utm_medium=social||Trump Empowers States with Massive Permitting Reform in First Step to Renewing Americas Roads, Rails, Runways and Rivers||WASHINGTON, D.C. ” President Donald Trump wrapped up infrastructure week at the Department of Transportation on Friday, highlighting his moves to reform what the White House called a burdensome regulatory system that has left American infrastructure crumbling.
3083||2017-06-09||http://www.breitbart.com/big-government/2017/06/09/president-trump-calls-out-leaker-james-comey/?utm_source=facebook&utm_medium=social||President Trump Calls Out Leaker James Comey||President Donald Trump reacted to fired FBI director James Comeys testimony before the Senate Intelligence Committee where he admitted leaking to a college professor the content of his private discussions with the president.
3172||2017-06-06||http://www.breitbart.com/big-hollywood/2017/06/06/trump-stabbed-death-central-park-performance-julius-caesar/?utm_source=facebook&utm_medium=social||Trump Stabbed to Death in Central Park Performance of Julius Caesar||Shakespeare in the Park began its summer season in New York Citys Central Park last month with a contemporary take on the playwrights Julius Caesar, in which the title character bears a not-so-subtle resemblance to President Donald Trump.
3219||2017-06-04||http://www.breitbart.com/video/2017/06/04/trump-will-necessary-wake-london-attack/?utm_source=facebook&utm_medium=social||Trump: I Will Do What Is Necessary In Wake of London Attack||Sunday in Washington, D.C. at the Fords Theatre annual gala, President Donald Trump vowed to do what is necessary to prevent attacks like the London terror attack this weekend that left seven people dead from spreading to our shores.
3243||2017-06-03||http://www.breitbart.com/big-hollywood/2017/06/03/anti-trump-play-building-wall-shuts-nyc-poor-ticket-sales/?utm_source=facebook&utm_medium=social||Anti-Donald Trump Play, Building the Wall, Shuts Down in NYC After Poor Ticket Sales||An Off-Broadway play that paints an ominous picture of a post-President Trump America is shutting down in New York City after struggling to build an audience in the liberal city.
3251||2017-06-04||http://www.breitbart.com/big-government/2017/06/04/trump-blasts-london-mayor-sadiq-khan-saying-no-reason-alarmed-london-attack/?utm_source=facebook&utm_medium=social||Trump Blasts London Mayor Sadiq Khan for Saying No Reason to Be Alarmed After London Attack||President Trump tore into Londons left-wing Mayor Sadiq Khan Sunday in the wake of a terror attack in London that left at least seven dead and dozens injured ” after Khan told Londoners there is no reason to be alarmed.
3266||2017-06-03||http://www.breitbart.com/video/2017/06/03/trump-right-now-nato-not-fair-united-states-soon-will/?utm_source=facebook&utm_medium=social||Trump: Right Now, NATO Is Not Fair to the United States, But It Soon Will Be||In President Donald Trumps weekly address, while outlining his accomplishments during his first foreign trip, Trump highlighted the NATO Summit in Brussels, where nations agreed they must do more to meet their financial obligations and pay their fair share.
3277||2017-06-02||http://www.breitbart.com/big-government/2017/06/02/nyt-trumps-climate-decision-a-victory-for-steve-bannon-pruitt/?utm_source=facebook&utm_medium=social||NYT: Trumps Climate Decision A Victory for Steve Bannon, Pruitt||President Donald Trumps decision to withdraw from the Paris Climate Agreement Thursday marked a decisive win for Chief Strategist Stephen K. Bannon and Environmental Protection Agency Administrator Scott Pruitt, as reported by the New York Times.
3297||2017-06-02||http://www.breitbart.com/big-government/2017/06/02/ann-coulter-scarborough-reall-stupid-trump-president-bannon-taunt/?utm_source=facebook&utm_medium=social||Ann Coulter: Scarborough Thinks Really Stupid Trump Will Fall for President Bannon Taunt||Ann Coulter, one of President Donald Trumps biggest boosters, blasted MSNBC host Joe Scarborough on Friday for thinking that Trump is so stupid that he would fall for the lefts and the medias President Bannon taunt.
3304||2017-06-02||http://www.breitbart.com/big-journalism/2017/06/02/move-mika-joe-scarborough-obsessed-steve-bannon/?utm_source=facebook&utm_medium=social||Move over, Mika: Joe Scarborough Is Obsessed with Steve Bannon||MSNBCs Morning Joe host Joe Scarborough and co-host Mika Brzezinski are set to wed. But Scarborough seems unable to shake thoughts ” or are they fantasies? ” about White House senior adviser Steve Bannon.
3308||2017-06-01||http://www.breitbart.com/big-hollywood/2017/06/01/trump-beheading-photographer-stands-art-cant-censor/?utm_source=facebook&utm_medium=social||Trump Beheading Photographer Stands By His Art: I Cant Censor Myself||Tyler Shields, the photographer behind the now-infamous image of Kathy Griffin holding the bloodied, decapitated head of President Donald Trump, says he stands by his art and wont censor any of his work in the future.
3323||2017-05-30||http://www.breitbart.com/big-government/2017/05/30/women-of-wall-eight-female-nurses-vietnam-war-memorial/?utm_source=facebook&utm_medium=social||Women of the Wall: The Eight Female Nurses Listed on the Vietnam War Memorial||WASHINGTON, DC ” Among the 58,000-plus names etched on the Vietnam War Memorial are the names of eight American civilian and military women, all nurses, who died from accidents or wounds sustained in Vietnam. On Memorial Day Monday, their names were remembered once again.
3356||2017-05-31||http://www.breitbart.com/texas/2017/05/31/trump-quietly-continues-obamas-catch-release-border/?utm_source=facebook&utm_medium=social||Trump Quietly Continues Obamas Catch and Release at Border||President Donald J. Trump is allowing former President Barack Obamas catch and release of illegal immigrants to continue deep into his administrations term with no end in sight to the controversial open borders protocol. Border Patrol agents are once again sounding the alarm and alerting the public about the separation between DCs rhetoric and the realities on the U.S.-Mexico border ” a practice that the agents hoped would become unnecessary under the Trump Administration.
3548||2017-05-25||http://www.breitbart.com/big-government/2017/05/25/trump-budget-requires-work-for-food-stamps/||Trump Budget Requires Work for Food Stamps||President Donald Trumps 2018 budget will save $190 billion over the next ten years by requiring able-bodied adults to work to receive food stamps.
3552||2017-05-25||http://www.breitbart.com/big-government/2017/05/25/trump-nato-pay/?utm_source=facebook&utm_medium=social||Trump to NATO: Pay Up||President Donald Trump urged members of the NATO alliance to start paying their fair share Thursday in Brussels, pointing out that their failures were hurting American taxpayers.
3554||2017-05-24||http://www.breitbart.com/big-government/2017/05/24/trump-surges-in-polls-during-first-foreign-trip/?utm_source=facebook&utm_medium=social||Trump Surges in Polls During First Foreign Trip||President Donald Trump is apparently receiving high marks for his foreign diplomacy. Rasmussen shows an upswing in the presidents approval ratings as he travels to various hot spots around the globe to advance his foreign policy goals.
3561||2017-05-24||http://www.breitbart.com/big-government/2017/05/24/vp-pence-rallies-base-reaffirms-the-wall-promises-obamacare-nightmare-will-end/?utm_source=facebook&utm_medium=social||VP Pence Rallies Base, Reaffirms the Wall, Promises Obamacare Nightmare Will End||Vice President Mike Pence delivered an address Wednesday to rally support for the Trump administration at the headquarters of a construction firm in Port Allen, Louisiana.
3562||2017-05-24||http://www.breitbart.com/economics/2017/05/24/trump-budget-kills-affirmative-action-corporate-welfare-agency/?utm_source=facebook&utm_medium=social||Trump Budget Kills Nixon-Era Affirmative Action Corporate Welfare Agency||The Trump administrations first budget would shutter the fifty year old Minority Business Development Agency (MBDA).
3619||2017-05-23||http://www.breitbart.com/jerusalem/2017/05/23/trump-condemns-evil-losers-behind-manchester-concert-massacre/?utm_source=facebook&utm_medium=social||Trump Condemns Evil Losers Behind Manchester Concert Massacre||JERUSALEM ” Speaking at a joint press conference today with Palestinian Authority President Mahmoud Abbas in Bethlehem, U.S. President Donald Trump condemned the evil losers who carried out last nights bombing of a pop concert in Manchester in which at least 22 people were murdered.
3654||2017-05-22||http://www.breitbart.com/jerusalem/2017/05/22/trump-flight-saudi-israel-thought-first-ever/?utm_source=facebook&utm_medium=social||Trump Flight from Saudi to Israel Thought to Be First Ever||JERUSALEM (AFP) “  US President Donald Trump was said to have blazed a new trail between the Arab world and Israel Monday, with his plane believed to be the first to fly directly from Saudi Arabia to the Jewish state.
3666||2017-05-21||http://www.breitbart.com/big-government/2017/05/21/trump-obama-muslim-islamic-terror-speech/?utm_source=facebook&utm_medium=social||Trump, Unlike Obama, Addressed Islamic Terror Directly||President Donald Trump and President Barack Obama delivered addresses to the Muslim world at roughly the same point in their respective presidencies.
3676||2017-05-20||http://www.breitbart.com/big-government/2017/05/20/trump-favors-ending-obamacare-subsidies/?utm_source=facebook&utm_medium=social||Trump Favors Ending Obamacare Subsidies||According to a Politico report, President Donald Trump told advisers that he favors ending Obamacare subsidies to bring Democrats to the negotiating table for a more comprehensive deal on repeal.
3685||2017-05-20||http://www.breitbart.com/national-security/2017/05/20/trump-first-saudi-meetings-will-bring-americans-jobs-jobs-jobs/?utm_source=facebook&utm_medium=social||Trump: First Saudi Meetings Will Bring Americans Jobs, Jobs, Jobs||President Donald Trump described the first day of his overseas trip in Saudi Arabia as a tremendous day ” referring to billions in investments ” in his first remarks at the top of one of several bilateral meetings.
3699||2017-05-20||http://www.breitbart.com/jerusalem/2017/05/20/trump-inks-350-billion-arms-deal-saudis/?utm_source=facebook&utm_medium=social||Trump Inks $350 Billion Arms Deal with Saudis||(Associated Press) President Donald Trump and Saudi King Salman signed a series of agreements cementing their countries military and economic partnerships.
3711||2017-05-20||http://www.breitbart.com/video/2017/05/20/trump-our-partners-must-show-that-theyre-partners-and-must-contribute-financially/?utm_source=facebook&utm_medium=social||Trump: Our Partners Must Show That Theyre Partners and Must Contribute Financially||During Fridays Weekly Address, President Trump previewed his overseas trip and said, our partners must show that theyre partners, they must show that theyre friends, and they must contribute financially to the tremendous cost “ the money that were spending “ is so big; its so much; and its not fair for our nation.  They have to help and Im sure they will.
3718||2017-05-18||http://www.breitbart.com/big-government/2017/05/18/trump-tells-reporters-walls-work-ask-israel/?utm_source=facebook&utm_medium=social||Trump Tells Reporters: Walls Work ” Just Ask Israel||President Trump stood by his campaign promise to build a wall along the southern border Thursday, telling reporters: Walls work ” just ask Israel.
3757||2017-05-18||http://www.breitbart.com/video/2017/05/18/trump-thought-comey-firing-bipartisan-support/?utm_source=facebook&utm_medium=social||Trump: I Thought Comey Firing Would Have Bipartisan Support||Thursday at a joint news conference
3762||2017-05-18||http://www.breitbart.com/big-government/2017/05/18/gop-steve-bannon-is-right-about-the-fight-to-save-america/?utm_source=facebook&utm_medium=social||GOP: Steve Bannon Is Right About the Fight to Save America||The Republican National Committee sent out a fund-raising email asking for assistance on President Donald Trumps Drain the Swamp agenda.
3780||2017-05-17||http://www.breitbart.com/big-government/2017/05/17/trump-under-siege-more-than-60-percent-of-nsc-employees-placed-by-obama/?utm_source=facebook&utm_medium=social||Trump Under Siege: More than 60 Percent of NSC Employees Placed by Obama||Calls are growing for President Trump to clean house at 1600 Pennsylvania Avenue, after a series of leaks aimed at embarrassing and undermining the president sprung from the White House this week.
3811||2017-05-16||http://www.breitbart.com/law-enforcement/2017/05/16/president-trump-vp-pence-meet-son-daughter-of-fallen-fresno-officer/?utm_source=facebook&utm_medium=social||President Trump, VP Pence Meet Son, Daughter of Fallen Fresno Officer||President Donald Trump and Vice President Mike Pence met the children of fallen Fresno officer Sgt. Rod Lucas at a memorial for fallen officers at the U.S. Capitol.
3834||2017-05-15||http://www.breitbart.com/big-government/2017/05/15/trump-administration-expands-pro-life-policy-to-ensure-no-taxpayer-funds-for-abortion-overseas/?utm_source=facebook&utm_medium=social||Trump Administration Expands Pro-Life Policy to Ensure No Taxpayer Funds for Abortion Overseas||President Donald Trump is implementing an executive order that not only prohibits non-governmental organizations (NGOs) that receive U.S. aid from performing abortions, but also directs the Secretary of State to expand that policy across most global health assistance funding.
3850||2017-05-15||http://www.breitbart.com/tech/2017/05/15/portland-bar-offers-free-whiskey-for-life-to-customers-that-punch-steve-bannon/?utm_source=facebook&utm_medium=social||Portland Bar Offers Free Whiskey for Life to Customers That Punch Steve Bannon||A bar in Portland, Oregon has offered a lifetime supply of free whiskey to any customer that punches White House Chief Strategist Steve Bannon.
3855||2017-05-15||http://www.breitbart.com/big-hollywood/2017/05/15/snl-showrunner-says-rosie-too-hateful-to-play-steve-bannon/?utm_source=facebook&utm_medium=social||SNL Showrunner: Rosie ODonnell Too Hateful to Play Steve Bannon||Lorne Michaels, the creative mind behind Saturday Night Live, said that the long-running variety show never reached out to Rosie ODonnell to take on the role of White House chief strategist Steve Bannon because she would have approached the role from hate rather than from comedy.
3886||2017-05-13||http://www.breitbart.com/big-government/2017/05/13/president-donald-trumps-1st-commencement-speech-america-dont-worship-government-worship-god/?utm_source=facebook&utm_medium=social||President Donald Trumps First Commencement Speech: In America We Dont Worship Government, We Worship God||President Donald Trump gave his first commencement speech at Liberty University on Saturday, encouraging dreamers to ignore critics, take risks, never quit, and remember that in America we dont worship government, we worship God.
3894||2017-05-12||http://www.breitbart.com/big-government/2017/05/12/trump-and-first-lady-celebrate-mothers-day-with-military-spouses-and-families/?utm_source=facebook&utm_medium=social||Trump and First Lady Celebrate Mothers Day with Military Spouses and Families||President Trump and first lady Melania Trump hosted military families at the White House on Friday to celebrate Mothers Day.
3902||2017-05-11||http://www.breitbart.com/economics/2017/05/11/trump-explains-trumponomics-self-respect-nation/?utm_source=facebook&utm_medium=social||Trump Explains Trumponomics: Its About Self-Respect As A Nation||The heart of President Donald Trumps economic outlook is America First nationalism.
3925||2017-05-11||http://www.breitbart.com/big-hollywood/2017/05/11/donald-trump-rips-no-talent-stephen-colbert-nothing-funny-says/?utm_source=facebook&utm_medium=social||Trump Fires Back at No-Talent Stephen Colbert: His Show Was Dying Before He Started Attacking Me||President Donald Trump fired back at Stephen Colbert in an interview this week following the Late Show hosts profanity-filled attacks on him during a segment on his show this month.
3967||2017-05-09||http://www.breitbart.com/big-government/2017/05/09/trump-fires-fbi-director-james-comey/?utm_source=facebook&utm_medium=social||Trump Fires FBI Director James Comey||President Donald Trump fired FBI Director James Comey on Tuesday, according to a statement from the White House.
3980||2017-05-08||http://www.breitbart.com/big-hollywood/2017/05/08/donald-trumps-walk-of-fame-star-vandalized-again-with-golden-toilet/?utm_source=facebook&utm_medium=social||Trump Walk of Fame Star Vandalized Again with Golden Toilet||Donald Trumps star on the Hollywood Walk of Fame has been vandalized for the third time in seven months.
3990||2017-05-08||http://www.breitbart.com/big-government/2017/05/08/steve-bannon-not-racist-anti-semitic-says-liberal-former-hollywood-partner/?utm_source=facebook&utm_medium=social||Bannon Not a Racist or Anti-Semitic, Says Liberal Former Hollywood Partner||Jeff Kwatinetz, founder of the Hollywood management company The Firm, has told the Hollywood Reporter that Stephen K Bannon ” his former partner, the former Breitbart executive chairman, and now White House senior adviser ” is not a racist or anti-Semitic.
4022||2017-05-06||http://www.breitbart.com/video/2017/05/06/trump-ahca-will-cause-premiums-and-deductibles-to-come-down/?utm_source=facebook&utm_medium=social||Trump: AHCA Will Cause Premiums and Deductibles to Come Down||During Fridays Weekly Address, President Trump said of the revised American Health Care Act, your premiums will come down, and your deductibles will come down.
4080||2017-05-03||http://www.breitbart.com/big-government/2017/05/03/whiteboard-rabbi-shmuley-steve-bannon-israel/?utm_source=facebook&utm_medium=social||RABBI SHMULEY: For Steve Bannon, Israel Is on the Whiteboard||Yesterday, insofar as anyone can recall, was the first-ever White House commemoration of Israels birth as a nation.
4108||2017-05-04||http://www.breitbart.com/video/2017/05/04/trump-freedom-not-gift-government-freedom-gift-god/?utm_source=facebook&utm_medium=social||Trump: Freedom Is Not a Gift From Government ” Freedom Is a Gift From God||Thursday in the Rose Garden at the White House, President Donald Trump declared freedom to be a gift from God before signing an executive order to protect the tax-exempt status of churches and religious groups if they engaged in politics.
4110||2017-05-04||http://www.breitbart.com/big-government/2017/05/04/president-trump-honors-little-sisters-of-the-poor-on-first-white-house-natl-day-of-prayer-in-years/?utm_source=facebook&utm_medium=social||President Trump Honors Little Sisters of the Poor on First White House Natl Day of Prayer in Years||WASHINGTON, D.C. ” President Donald Trump held the first National Day of Prayer event at the White House in many years on Thursday in the Rose Garden with approximately 150 guests in attendance.
4122||2017-05-03||http://www.breitbart.com/big-government/2017/05/03/finally-know-steve-bannons-whiteboard-donald-trump-promises-voters/?utm_source=facebook&utm_medium=social||We Finally Have Photos of Steve Bannon Whiteboard of Trump Promises||According to multiple reports, President Donald Trumps senior counselor Steve Bannon has displayed a whiteboard in his West Wing office of all the promises that he made to voters.
4188||2017-05-01||http://www.breitbart.com/national-security/2017/05/01/trump-i-would-absolutely-be-honored-to-meet-with-n-korean-dictator-under-the-right-circumstances/?utm_source=facebook&utm_medium=social||Trump Would Be Honored to Meet Pretty Smart Cookie Kim Jong-un||In a Monday interview, President Donald Trump said he would be willing to meet with North Korean dictator Kim Jong-un to discuss the latters nuclear weapons program under the proper circumstances.
4221||2017-04-30||http://www.breitbart.com/video/2017/04/30/trump-cbss-dickerson-love-show-call-deface-nation/?utm_source=facebook&utm_medium=social||Trump to CBSs Dickerson: I Love Your Show ” I Call It Deface the Nation||Sunday on CBSs Face the Nation, President Donald Trump said to host John Dickerson, I love your show. I call it Deface the Nation.
4230||2017-04-29||http://www.breitbart.com/video/2017/04/29/trump-obamacare-is-dead-its-gone/?utm_source=facebook&utm_medium=social||Trump: Obamacare Is Dead, Its Gone||During his Saturday Harrisburg, PA rally, President Donald Trump addressed Obamacare, proclaiming it dead.
4231||2017-04-29||http://www.breitbart.com/video/2017/04/29/trump-first-100-days-rally-cnn-msnbc-fake-news/?utm_source=facebook&utm_medium=social||Trump at First 100 Days Rally: CNN, MSNBC Are Fake News||Saturday, President Donald Trump held a rally in Harrisburg, PA.
4232||2017-04-29||http://www.breitbart.com/big-government/2017/04/29/trump-ridicules-media-at-pennsylvania-rally-they-deserve-a-big-fat-failing-grade/?utm_source=facebook&utm_medium=social||Trump Ridicules Media at Pennsylvania Rally: They Deserve a Big, Fat Failing Grade||President Donald Trump told an overflowing crowd in Pennsylvania that the media deserves a very, very big, fat failing grade for their dishonest coverage of his administration today, and especially for their work during the past election.
4235||2017-04-29||http://www.breitbart.com/video/2017/04/29/trump-the-first-100-days-of-my-administration-has-been-just-about-the-most-successful-in-our-countrys-history/?utm_source=facebook&utm_medium=social||Trump: The First 100 Days of My Administration Has Been Just About the Most Successful In Our Countrys History||During Fridays Weekly Address, President Trump said, I truly believe that the first 100 days of my administration has been just about the most successful in our countrys history.
4243||2017-04-29||http://www.breitbart.com/big-government/2017/04/29/hasan-minhaj-at-whcd-steve-bannon-a-nazi-jeff-sessions-a-racist-who-uses-n-word/||Hasan Minhaj at WHCD: Steve Bannon a Nazi, Jeff Sessions a Racist Who Uses N Word||Comedian and Daily Show correspondent Hasan Minhaj performed at the White House Correspondents Dinner tonight, where he called White House Chief Strategist Steve Bannon a Nazi and Attorney General Jeff Sessions a racist.
4252||2017-04-29||http://www.breitbart.com/big-government/2017/04/29/trump-illegal-immigration-down-by-unprecedented-73/?utm_source=facebook&utm_medium=social||Trump: Illegal Immigration Down by Unprecedented 73%||Speaking at a rally in Harrisburg, Pennsylvania, Saturday President Donald Trump discussed the severe decline in illegal immigration under his presidency.
4253||2017-04-29||http://www.breitbart.com/big-government/2017/04/29/trump-to-ms-13-were-sending-you-the-hell-out-of-our-country/?utm_source=facebook&utm_medium=social||Trump to MS-13: Were Sending You The Hell out of Our Country||Speaking at a rally in Harrisburg, PA, President Donald Trump assured American citizens that the Salvadoran gang known as MS-13 would be quickly removed from the country.
4265||2017-04-28||http://www.breitbart.com/national-security/2017/04/28/trump-there-is-a-chance-we-could-end-up-having-a-major-major-conflict-with-north-korea/?utm_source=facebook&utm_medium=social||Trump Warns of Potential Major, Major Conflict with North Korea||On Thursday, during an Oval Office interview with Reuters, President Trump said: There is a chance that we could end up having a major, major conflict with North Korea. Absolutely.
4280||2017-04-28||http://www.breitbart.com/big-government/2017/04/28/trump-im-a-nationalist-and-a-globalist/?utm_source=facebook&utm_medium=social||Trump: Im a Nationalist and a Globalist||On the eve of the 100 days in office milestone, President Donald Trump claims he is both a nationalist and a globalist ” despite campaign promises that his presidency would reject globalism and put America first.
4288||2017-04-28||http://www.breitbart.com/video/2017/04/28/trump-well-build-wall-thats-easy-one/?utm_source=facebook&utm_medium=social||Trump: Well Build the Wall, Thats an Easy One||Friday at the National Rifle Association (NRA) Leadership Forum in Atlanta, President Donald Trump declared he would build a wall on the U.S.-Mexico border, adding, Thats an easy one.
4289||2017-04-28||http://www.breitbart.com/big-government/2017/04/28/trump-to-nra-you-came-through-for-me-i-am-going-to-come-through-for-you/?utm_source=facebook&utm_medium=social||Trump to NRA: You Came Through for Me, I am Going to Come Through for You||During his April 28 speech to the NRAs Leadership Forum in Atlanta, President Donald Trump told the audience, You came through for me and I am going to come through for you.
