id||pub_date||link||headline||par1
8067||2017-01-04||http://www.breitbart.com/big-government/2017/01/04/trump-transition-team-demands-list-of-every-executive-order-obama-made-on-immigration-assets-to-build-border-wall-reuters/?utm_source=facebook&utm_medium=social||Trump Transition Team Demands List of Every Executive Order Obama Made on Immigration, Assets to Build Border Wall: Reuters||The Trump transition team wants copies of every single executive order and directive outgoing President Obama ordered on immigration since he took office, along with several other documents that will let them assess how to beef up border security, according to a Reuters exclusive.
8093||2017-01-03||http://www.breitbart.com/big-government/2017/01/03/president-trump-can-free-2nd-amendment-ninth-circuits-grip/?utm_source=facebook&utm_medium=social||President Trump Can Free Second Amendment from Ninth Circuits Grip||The United States Court of Appeals for the Ninth Circuit has been chipping away at the Second Amendment for years, but when he takes office, President Donald Trump can limit the ramifications of their decisions“actually reversing them in some instances“by appointing the pro-Second Amendment, pro-Constitution justice he pledged to appoint while running for office.
8114||2017-01-02||http://www.breitbart.com/california/2017/01/02/california-consumers-love-trump-confidence-hits-9-year-high/?utm_source=facebook&utm_medium=social||Trump-mania: California Consumer Confidence Hits 9-Year High||As voters, Californians rejected Donald Trump. As consumers, they love him.
8172||2017-01-01||http://www.breitbart.com/news/the-latest-trump-holds-new-years-bash-at-mar-a-lago/?utm_source=facebook&utm_medium=social||Trump Begins Journey to Make America Great Again with  New Years Bash at Mar-a-Lago||WEST PALM BEACH, Fla. (AP) ” The Latest on President-elect Donald Trump (all times EST):
8210||2016-12-30||http://www.breitbart.com/big-government/2016/12/30/trump-putin-very-smart-to-not-retaliate-over-obama-sanctions/?utm_source=facebook&utm_medium=social||Trump: Putin Very Smart to Not Retaliate over Obama Sanctions||Donald Trump took to Twitter Friday to praise Vladimir Putin for his decision to delay his response to President Obamas new sanctions against Russia for the countrys alleged interference in the 2016 U.S. election.
8231||2016-12-29||http://www.breitbart.com/big-government/2016/12/29/trump-team-floats-public-private-veterans-health-care/?utm_source=facebook&utm_medium=social||Trump Team Floats Public-Private Veterans Health Care||President-elect Donald Trump met with health care executives on Wednesday to begin a serious reform of the Department of Veterans Affairs.
8236||2016-12-30||http://www.breitbart.com/radio/2016/12/30/bannon-hobbits-deplorables-great-run-2016-top-first-inning/?utm_source=facebook&utm_medium=social||Steve Bannon: Hobbits and Deplorables Had a Great Run in 2016, but Its Only Top of the First Inning||Stephen K. Bannon, former Breitbart News executive chairman, founding host of Breitbart News Daily, and now chief strategist for the incoming Trump White House, made a special appearance on the final live show of 2016.
8239||2016-12-30||http://www.breitbart.com/big-journalism/2016/12/30/frontpage-magazine-man-year-stephen-k-bannon-unsung-hero/?utm_source=facebook&utm_medium=social||Frontpage Magazine Man of the Year: Stephen K. Bannon, an Unsung Hero||David Horowitz and Matthew Vadum pay tribute to Frontpage Magazines 2016 Man of the Year: Stephen K. Bannon, former Breitbart News Executive Chairman and current chief strategist to President-elect Donald Trump.
8265||2016-12-29||http://www.breitbart.com/big-government/2016/12/29/cnn-calls-michigan-middle-school-build-the-wall-chant-racism/?utm_source=facebook&utm_medium=social||CNN Calls Michigan Middle School Build the Wall Chant Racism||On the day after Donald J. Trump was declared the President-elect, an incident in a Michigan middle school became big news when video of kids chanting build a wall was deemed a racist attack on students of color. Now the school is dealing with the backlash from that video and it has some parents upset at the student who posted the footage online.
8333||2016-12-27||http://www.breitbart.com/big-government/2016/12/27/trump-blasts-united-nations-on-twitter-praises-his-election-win-the-world-was-gloomy-before-i-won/?utm_source=facebook&utm_medium=social||Trump Blasts United Nations on Twitter, Praises his Election Win: The World Was Gloomy Before I Won||President-elect Donald Trump is using Twitter to praise his victory, saying the world was gloomy before he won the election.
8341||2016-12-26||http://www.breitbart.com/california/2016/12/26/president-obama-increases-u-s-regulatory-state-12-one-month/?utm_source=facebook&utm_medium=social||President Obama Increases U.S. Regulatory State by 12% in one Month||President Barack Obama set the all-time record in November 2016 for the number of regulatory pages in the Federal Register at 81,640 pages, but in the last month he has pushed that record up by over 12 percent to 91,642 pages.
8358||2016-12-26||http://www.breitbart.com/2016-presidential-race/2016/12/26/trump-set-to-fill-over-100-federal-court-vacancies-in-large-judiciary-shake-up/?utm_source=facebook&utm_medium=social||Trump Set to Fill Over 100 Federal Court Vacancies in Large Judiciary Shake-Up||President-elect Donald Trump will be free to appoint over 100 federal court vacancies as well as a Supreme Court justice when he becomes president next month.
8436||2016-12-23||http://www.breitbart.com/big-government/2016/12/23/trump-team-responds-to-carl-paladinos-reprehensible-comments-about-obamas/?utm_source=facebook&utm_medium=social||Trump Team Responds to Carl Paladinos Reprehensible Comments about Obamas||President-elect Donald Trumps transition team responded to Carl Paladinos racist remarks that he allegedly made about President Obama and First Lady Michelle Obama to ArtVoice, a New York publication, saying that in 2017 he would like President Obama to die, and Michelle Obama to return to being a male and let loose in the outback of Zimbabwe where she lives comfortably in a cave with Maxie, the gorilla.
8437||2016-12-23||http://www.breitbart.com/big-government/2016/12/23/trump-hints-defunding-un-anti-israel-vote/?utm_source=facebook&utm_medium=social||Trump on UN Anti-Israel Vote: Things Will Be Different After Jan. 20||President-elect Donald Trump responded to the UN Security Councils passage of an anti-Israel resolution Friday ” thanks to U.S.  abstention by President Barack Obama ” by Tweeting: As to the U.N., things will be different after Jan. 20th.
8459||2016-12-23||http://www.breitbart.com/video/2016/12/23/trump-msnbcs-brzezinski-nuke-tweets-let-arms-race/?utm_source=facebook&utm_medium=social||Trump to MSNBCs Brzezinski on Nuke Tweets: Let It Be an Arms Race||Friday on MSNBCs Morning Joe, co-host Mika Brzezinski relayed a conversation she had with President-elect Donald Trump in which she was seeking for a tweet he sent about the United States nuclear capability a day earlier.
8613||2016-12-18||http://www.breitbart.com/jerusalem/2016/12/18/trump-team-u-s-embassy-will-move-to-jerusalem-too-early-to-say-when/?utm_source=facebook&utm_medium=social||Trump Remains Firmly Committed to Moving U.S. Embassy to Jerusalem||TEL AVIV ” President-elect Donald Trump remains firmly committed to moving the U.S. Embassy from Tel Aviv to Jerusalem, his transition team said.
8634||2016-12-17||http://www.breitbart.com/big-government/2016/12/17/trump-responds-michelle-obama-slams-demented-krugman-alabama-thank-tour-finale/?utm_source=facebook&utm_medium=social||Trump Responds to Michelle Obama, Slams Demented Paul Krugman at Alabama Thank You Tour Finale||MOBILE, Alabama ” Despite on-and-off rain, President-elect Donald Trump returned to Ladd-Peebles Stadium Saturday, declaring Mobile the place where it all began.
8637||2016-12-15||http://www.breitbart.com/jerusalem/2016/12/15/trump-nominate-david-friedman-u-s-ambassador-israel/?utm_source=facebook&utm_medium=social||Trump to Nominate David Friedman as U.S. Ambassador to Israel||TEL AVIV ” President-elect Donald Trump announced in a statement on Thursday that will nominate attorney and advisor David Friedman as U.S. ambassador to Israel.
8643||2016-12-17||http://www.breitbart.com/2016-presidential-race/2016/12/17/steve-bannon-strategy-helped-bring-donald-trump-victory-election-day/?utm_source=facebook&utm_medium=social||Steve Bannon Strategy Helped Bring Trump to Victory on Election Day||Hunter Lewis writes at AgainstCronyCapitalism.org that it was Steve Bannons one brilliant idea that helped Donald Trump win the presidential election in November 2016:
8657||2016-12-16||http://www.breitbart.com/big-government/2016/12/16/trump-to-orlando-crowd-dream-big-and-bold-and-daring/?utm_source=facebook&utm_medium=social||Trump to Orlando Crowd: Dream Big and Bold and Daring||Starting off wishing Orlando a Merry Christmas as he bounded onstage ” surrounded by Christmas trees ” Donald Trump came out to the cheers of a huge crowd in Orlando, Florida Friday evening.
8734||2016-12-14||http://www.breitbart.com/big-government/2016/12/14/trump-boom-companies-vow-tens-thousands-us-jobs-trump-win/?utm_source=facebook&utm_medium=social||Trump Boom: Companies Vow Tens of Thousands of U.S. Jobs After Trump Win||The number of companies announcing a ramping up of investment in the U.S., and the corresponding rush to create jobs for Americans, have jumped to a quicker pace since the election of Donald J. Trump to the White House.
8758||2016-12-13||http://www.breitbart.com/video/2016/12/13/trump-going-say-merry-christmas/?utm_source=facebook&utm_medium=social||Trump: We Are Going to Say Merry Christmas Again||Tuesday at a stop on his Thank You tour in West Allis, WI, President-elect Donald Trump opened up his appearance by fulfilling a campaign promise regarding the use of Merry Christmas as a holiday greeting.
8761||2016-12-14||http://www.breitbart.com/big-government/2016/12/14/trump-victory-sends-small-business-optimism-skyrocketing/?utm_source=facebook&utm_medium=social||Trump Victory Sends Small Business Optimism Skyrocketing||Optimism among small business owners is surging since the election of Donald J. Trump as the 45th President of the United States of America, a new survey reveals.
8763||2016-12-13||http://www.breitbart.com/radio/2016/12/13/trumpocrat-david-mudcat-saunders-charges-racism-white-nationalism-steve-bannon-insane/?utm_source=facebook&utm_medium=social||Trumpocrat David Mudcat Saunders: Charges of Racism and White Nationalism Against Steve Bannon Are Insane||David Saunders, veteran Democratic strategist-turned-Trumpocrat, told Breitbart News Daily SiriusXM host Matt Boyle the charges of racism thrown at former Breitbart News executive and founding Breitbart News Daily host Steve Bannon, following his departure to work for the Tump campaign and Trump White House, are utterly ridiculous.
8826||2016-12-11||http://www.breitbart.com/tech/2016/12/11/trump-themed-star-wars-posters-featuring-milo-spotted-around-rogue-one-premier-area/?utm_source=facebook&utm_medium=social||Trump-Themed Star Wars Posters Featuring MILO Spotted Around Rogue One Premiere Area||Several pro-Trump Star Wars parody posters have been spotted around Hollywood, appearing on bus stops and benches near the Pantages Theater where the premiere for Rogue One: A Star Wars Story took place this weekend.
8829||2016-12-12||http://www.breitbart.com/news/trump-taps-retired-general-kelly-for-homeland-security-chief/?utm_source=facebook&utm_medium=social||Trump taps retired general Kelly for Homeland Security chief||New York (AFP) “ Donald Trump announced Monday he will nominate retired general John Kelly to head the Department of Homeland Security, the third ex-military man tapped for a top job in his presidential administration.
8838||2016-12-11||http://www.breitbart.com/big-journalism/2016/12/11/washington-times-top-10-fake-news-stories-9-bannon-white-supremacist/?utm_source=facebook&utm_medium=social||Washington Times Top 10 Fake News Stories: #9 Bannon White Supremacist||Kelly Riddell writes in the Washington Times that since fake news is all the rage within the mainstream media, she has comprises a Top 10 list of news stories reported on by the mainstream media that turned out to be, well, fake. Number 9 on the list is the medias false reporting that Steve Bannon, former Breitbart Executive Chairman and current chief strategist to Donald Trump, is a white supremacist.
8839||2016-12-11||http://www.breitbart.com/video/2016/12/11/trump-im-not-taking-a-wrecking-ball-to-obamas-legacy-im-doing-whats-right/?utm_source=facebook&utm_medium=social||Trump: Im Not Taking a Wrecking Ball to Obamas Legacy, Im Doing Whats Right||On this weekends broadcast of on Fox News Sunday, President-elect Donald Trump said he was not planing to take a wrecking ball to President Barack Obamas legacy but instead he will attempt to do whats right.
8843||2016-12-11||http://www.breitbart.com/video/2016/12/11/trump-dems-pushing-russia-hacking-massive-landslide-victory/?utm_source=facebook&utm_medium=social||Trump: Dems Pushing Russia Hacking Because of My Massive Landslide Victory||On this weekends broadcast of on Fox News Sunday, while discussing the reported Russian interference in the 2016 presidential election, President-elect Donald Trump said he thought the Democrats were putting it out because of what he called one of the greatest defeats in the history of politics in this country.
8845||2016-12-11||http://www.breitbart.com/big-government/2016/12/11/five-actions-president-trump-can-take-to-save-2nd-amendment/?utm_source=facebook&utm_medium=social||Five Actions President Trump Can Take to Save 2nd Amendment||President-elect Donald Trump won on November 8 after running a pro-gun campaign focused on defending and upholding the Second Amendment.
8850||2016-12-11||http://www.breitbart.com/video/2016/12/11/trump-im-open-minded-environment-issues/?utm_source=facebook&utm_medium=social||Trump: Im Very Open-Minded on Environment Issues||On this weekends broadcast of on Fox News Sunday, President-elect Donald Trump said he is very open-minded on environmental issues.
8908||2016-12-09||http://www.breitbart.com/video/2016/12/09/trump-companies-that-leave-u-s-will-have-a-very-very-substantial-tariff-or-tax-to-pay/?utm_source=facebook&utm_medium=social||Trump: Companies That Leave U.S. Will Have a Very, Very Substantial Tariff or Tax to Pay||Friday at a rally for Louisiana Senate candidate Republican John Kennedy in Baton Rouge, President-elect Donald Trump restated his proposal to impose a substantial tariff or tax, on the imports of companies that move production out of the United States.
8930||2016-12-08||http://www.breitbart.com/2016-presidential-race/2016/12/08/trump-expected-to-tap-labor-secretary-who-prefers-foreign-labor-to-american-workers/?utm_source=facebook&utm_medium=social||Trump Expected to Tap Labor Secretary Who Prefers Foreign Labor to American Workers||President-elect Donald J. Trump is expected to name as his Labor Secretary fast food executive Andy Puzder, who stands diametrically opposed to Trumps signature issues on trade and immigration ” which won him the election.
8962||2016-12-07||http://www.breitbart.com/2nd-amendment/2016/12/07/obama-blame-second-amendment-not-radical-islamic-terror/?utm_source=facebook&utm_medium=social||President Obama: Blame Second Amendment, Not Radical Islamic Terror||During a December 6 speech on national security and the fight against terrorism, President Obama refused to criticize radical Islamic terror but had no problem suggesting that the availability of firearms in America is problematic.
8974||2016-12-07||http://www.breitbart.com/radio/2016/12/07/steve-bannon-fathers-grandfathers-deplorables-turned-war-around-pearl-harbor/?utm_source=facebook&utm_medium=social||Steve Bannon: Fathers and Grandfathers of Deplorables Turned War Around After Pearl Harbor||Former Breitbart News executive chairman and Breitbart News Daily founding host Stephen K. Bannon, who departed to work for the Trump campaign and now the Trump White House, was a special guest of the show on Wednesday to talk about the 75th anniversary of Pearl Harbor.
9014||2016-12-06||http://www.breitbart.com/big-government/2016/12/06/trump-announces-japanese-telecom-co-will-invest-50-billion-create-50000-jobs-u-s/?utm_source=facebook&utm_medium=social||Trump Announces Japanese Telecom Co. Will Invest $50 Billion to Create 50,000 Jobs in U.S.||In the wake of reports that SoftBank Group Corp. founder and Chief Executive Officer Masayoshi Son was set to meet with Donald Trump in New York, the President-elect announced that the Japanese telecommunications company will invest up to $50 billion in the U.S. which includes plans to create 50,000 new jobs here.
9069||2016-12-05||http://www.breitbart.com/news/trump-names-former-rival-ben-carson-as-housing-secretary/?utm_source=facebook&utm_medium=social||Trump names former rival Ben Carson as housing secretary||Washington (AFP) “ US President-elect Donald Trump on Monday chose Ben Carson, the mild-mannered retired neurosurgeon who challenged him for the Republican nomination, to turn around troubled US inner cities as secretary of housing and urban development.
9075||2016-12-04||http://www.breitbart.com/video/2016/12/04/anderson-cooper-shuts-down-elizabeth-warren-no-evidence-steve-bannon-white-supremacist/?utm_source=facebook&utm_medium=social||Anderson Cooper Shuts Down Elizabeth Warren ” No Evidence Steve Bannon Is a White Supremacist||Last week on CNNs Anderson Cooper 360, Sen. Elizabeth Warren (D-MA) took a shot at President-elect Donald Trump by accusing him of doubling down on racism and bigotry with the selection of former Breitbart News executive chairman Stephen K. Bannon as his chief strategist.
9094||2016-12-04||http://www.breitbart.com/big-hollywood/2016/12/04/trump-rips-unwatchable-snl-twitter-alec-baldwins-impression-cant-get-worse/?utm_source=facebook&utm_medium=social||Trump Rips Unwatchable SNL: Alec Baldwins Impression Cant Get Any Worse||President-elect Donald Trump blasted Saturday Night Live on Twitter Sunday morning, calling the show biased and unfunny and singling out actor Alec Baldwins impression of him for criticism, writing that it just cant get any worse.
9108||2016-12-03||http://www.breitbart.com/video/2016/12/03/watch-snl-mocks-trumps-twitter-habits-portrays-steve-bannon-as-the-grim-reaper/?utm_source=facebook&utm_medium=social||Watch: SNL Portrays Breitbarts Steve Bannon as the Grim Reaper||This weeks Saturday Night Live cold open took aim at President-elect Donald Trump for his Twitter habits, mocking how he retweets random people ” and portrayed Steve Bannon as Death Himself.
9150||2016-12-02||http://www.breitbart.com/2016-presidential-race/2016/12/02/trump-mad-dog-mattis-closest-thing-gen-george-patton/?utm_source=facebook&utm_medium=social||Trump: Mad Dog Mattis Closest Thing We Have to Gen. George Patton||President-elect Donald Trump tapped retired Marine Gen. James Mattis as his secretary of defense on Thursday, saying Mattis is the closest thing we have to Gen. George Patton.
9186||2016-12-01||http://www.breitbart.com/video/2016/12/01/trump-trust-going-build-wall/?utm_source=facebook&utm_medium=social||Trump: Trust Me We Are Going To Build a Wall||Thursday in Indianapolis, IN at the Carrier factory he recently announced would be keeping 1,000 jobs in the United States, President-elect Donald Trump vowed a border wall would be built.
9235||2016-11-29||http://www.breitbart.com/video/2016/11/29/gingrich-bannon-priebus-picks-best-single-thing-trump-has-done-so-far/?utm_source=facebook&utm_medium=social||Gingrich: Bannon, Priebus Picks Best Single Thing Trump Has Done So Far||Tuesday in an interview with USA Todays Capital Download, former Speaker of the House Newt Gingrich said President-elect Donald Trump appointing Republican National Committee chairman Reince Priebus as his White House chief of staff and former Trump campaign CEO Steve Bannon as his chief strategist is the best single thing Trump has done in the last three weeks.
9239||2016-11-29||http://www.breitbart.com/big-government/2016/11/29/president-elect-donald-trump-cuts-deal-to-keep-carrier-corporation-in-united-states/?utm_source=facebook&utm_medium=social||President-Elect Donald Trump Cuts Deal to Keep Carrier Corporation in United States||Donald Trump isnt even president yet and hes already winning for American workers.
9288||2016-11-28||http://www.breitbart.com/tech/2016/11/28/trump-tower-temporarily-renamed-dump-tower-on-google-maps/?utm_source=facebook&utm_medium=social||Trump Tower Temporarily Renamed Dump Tower on Google Maps||Google Maps temporarily renamed President-elect Donald Trumps New York HQ from Trump Tower to Dump Tower over the weekend.
9291||2016-11-28||http://www.breitbart.com/news/trump-wins-michigans-16-electoral-votes-state-board-says/?utm_source=facebook&utm_medium=social||Trump wins Michigans 16 electoral votes, state board says||LANSING, Mich. (AP) ” President-elect Donald Trump has won Michigans 16 electoral votes.
9312||2016-11-26||http://www.breitbart.com/big-government/2016/11/26/trump-mocks-jill-stein-defeated-demoralized-democrats-ridiculous-recount-scam/?utm_source=facebook&utm_medium=social||Trump Mocks Jill Stein, Defeated, Demoralized Dems for Ridiculous Recount Scam||Mary Kay Linge writes at the New York Post:
9318||2016-11-27||http://www.breitbart.com/2016-presidential-race/2016/11/27/richmond-times-dispatch-steve-bannon-discusses-his-richmond-roots-and-condemning-racism/?utm_source=facebook&utm_medium=social||Richmond Times-Dispatch: Steve Bannon Discusses His Richmond Roots and Condemning Racism||Graham Moomaw of the Richmond Times-Dispatch interviews Steve Bannon, Donald Trumps new chief strategist and a self-described son of Richmond. Bannon, whose close-knit Irish Catholic family lived in a racially diverse working class neighborhood, describes the very strong imprint Richmonds North Side had on him and on his support for Americas inner cities. Im a huge advocate of the inner cities and the vibrancy of the city. I think Richmonds an example of that, Bannon tells Moomaw.
9324||2016-11-27||http://www.breitbart.com/2016-presidential-race/2016/11/27/boston-globe-harvard-classmates-remember-steve-bannons-intellect-leadership/?utm_source=facebook&utm_medium=social||Boston Globe: Harvard Classmates Remember Steve Bannons Intellect and Leadership||The Boston Globes Matt Viser profiles Trump chief strategist Steve Bannons time as a student at Harvard Business School. Though Bannon ” who grew up in a working class Irish Catholic family in Richmond, Virginia, working at a junk yard during his summer breaks ” was not from an Ivy League pedigree, he earned a coveted spot in the prestigious school after serving in the U.S. Navy and earning undergraduate and post-graduate degrees at Virginia Tech and Georgetown University. Bannons Harvard classmates remember him as a gregarious and intellectually gifted leader with a knack for cutting to the heart of an issue. 
9368||2016-11-26||http://www.breitbart.com/news/trump-hails-castros-death-in-tweet/?utm_source=facebook&utm_medium=social||Trump hails Castros death in tweet||Washington (AFP) “ President-elect Donald Trump on Saturday weighed in on the death of Cuban revolutionary leader Fidel Castro, tweeting simply Fidel Castro is dead!
9374||2016-11-21||http://www.breitbart.com/london/2016/11/21/trump-farage-great-job-uk-ambassador-usa/?utm_source=facebook&utm_medium=social||Trump: Farage Would do Great Job As UK Ambassador to USA||President-elect Donald J. Trump has ostensibly thrown his support behind the idea of UK Independence Party (UKIP) leader Nigel Farage becoming the British Ambassador to the United States in a tweet issued late on Monday night.
9378||2016-11-25||http://www.breitbart.com/2016-presidential-race/2016/11/25/politico-steve-bannons-first-pick-for-president-was-sarah-palin/?utm_source=facebook&utm_medium=social||Politico: Steve Bannons First Pick for President Was Sarah Palin||RuairÃ­ Arrieta-Kenna writes at Politico that before Stephen K. Bannon embraced the mogul from Manhattan, the former Breitbart Executive Chairman and current chief strategist to Donald Trump had his eye on another gifted populist outsider ” former Alaska governor Sarah Palin. Both Bannon and Palin realized that the Republican Party needed to drain the swamp in DC and champion the forgotten American working class if it ever wanted to regain the White House again.
9381||2016-11-23||http://www.breitbart.com/sports/2016/11/23/harsh-anti-trump-mavericks-owner-mark-cuban-spotted-meeting-trump-adviser-steve-bannon/?utm_source=facebook&utm_medium=social||Anti-Trump Mavericks Owner Mark Cuban Spotted Meeting with Steve Bannon||After spending months attacking President-elect Donald Trump at every opportunity, Dallas Mavericks owner and billionaire businessman Mark Cuban was spotted meeting with White House strategist Stephen Bannon on Tuesday.
9395||2016-11-25||http://www.breitbart.com/radio/2016/11/25/exclusive-ann-coulter-on-kobach-in-the-cabinet-immigration-and-building-the-wall/?utm_source=facebook&utm_medium=social||Exclusive ” Ann Coulter on Kobach in the Cabinet, Immigration, and Building the Wall||Ann Coulter, author and goddess of the online right according to SiriusXM host Alex Marlow, joined Breitbart News Daily for a special Thanksgiving discussion on immigration, the new Trump cabinet, building the wall, the existential threat of open-borders globalism, and how Donald Trump is going to save the last Christian country on Earth.
