id||pub_date||link||headline||par1
6180||2017-02-28||http://www.breitbart.com/big-government/2017/02/28/black-history-month-trump-begins-speech-slams-antisemitism/?utm_source=facebook&utm_medium=social||Trump Begins Speech with Black History Month, Slams Antisemitism||President Donald Trump opened his highly anticipated address to a special joint session of Congress on Tuesday evening with a message of tolerance, reminding the country about Black History Month and condemning recent antisemitic attacks.
6181||2017-02-28||http://www.breitbart.com/video/2017/02/28/trump-what-would-you-say-to-american-family-that-loses-job-income-or-loved-one-because-us-wouldnt-enforce-law/?utm_source=facebook&utm_medium=social||Trump: What Would You Say To American Family That Loses Job, Income, or Loved One Because US Wouldnt Enforce Law?||While discussing immigration during his speech before Congress on Tuesday, President Trump said, To any in Congress who do not believe we should enforce our laws, I would ask you this one question: What would you say to the American family that loses their jobs, their income, or their loved one, because America refused to uphold its laws and defend its borders?
6201||2017-02-27||http://www.breitbart.com/big-government/2017/02/27/president-trump-plans-unveil-obamacare-repeal-plan/?utm_source=facebook&utm_medium=social||President Trump to Unveil Obamacare Repeal Plan||President Trump told governors at a White House meeting that he looks to announce his own Obamacare replacement plan within the next few weeks.
6203||2017-02-27||http://www.breitbart.com/video/2017/02/27/trump-trade-nationalist-true-sense/?utm_source=facebook&utm_medium=social||Trump on Trade: I Am a Nationalist in a True Sense||Monday after speaking the nations governors at the White House, President Donald Trump offered a preview of his upcoming address to Congress set for Tuesday night.
6219||2017-02-27||http://www.breitbart.com/big-government/2017/02/27/new-hampshire-2nd-amendment/?utm_source=facebook&utm_medium=social||New Hampshire: The 2nd Amendment is Your Concealed Carry Permit||New Hampshire Governor Chris Sununu (R) signed a bill which immediately abolished the requirement that state residents obtain a permit before carrying a concealed handgun for self-defense.
6257||2017-02-26||http://www.breitbart.com/big-hollywood/2017/02/26/trump-fans-urge-oscars-boycott/?utm_source=facebook&utm_medium=social||Trump Fans Urge Oscars Boycott: Put The Lying, Socialist Perverts Out of Business||Conservatives and supporters of President Donald Trump have collectively taken to social media on the eve of the 89th annual Academy Awards to encourage a boycott of the film businesss biggest night, as Hollywood insiders and industry observers predict Sunday nights show could be the most politicized in recent memory.
6258||2017-02-26||http://www.breitbart.com/big-journalism/2017/02/26/new-york-times-steve-bannon-want/?utm_source=facebook&utm_medium=social||New York Times: What Does Steve Bannon Want?||Weekly Standard senior editor Christoper Caldwell writes at the New York Times:
6263||2017-02-26||http://www.breitbart.com/big-government/2017/02/26/trump-administration-solicits-border-wall-proposals-from-contractors/?utm_source=facebook&utm_medium=social||Trump Administration Solicits Border Wall Proposals from Contractors||The Department of Homeland Security wants companies to begin submitting designs for President Donald Trumps border wall beginning March 6.
6276||2017-02-25||http://www.breitbart.com/2016-presidential-race/2017/02/25/trump-escalates-war-on-media-will-not-attend-white-house-correspondents-dinner/?utm_source=facebook&utm_medium=social||Trump Escalates War on Media, Will Not Attend White House Correspondents Dinner||Donald Trump has further escalated his war on the mainstream media, as he announced on Saturday that he will not be attending the White House Correspondents dinner. Trump will be the first president to do so in 30 years.
6279||2017-02-25||http://www.breitbart.com/big-government/2017/02/25/trump-signs-new-executive-order-introducing-regulation-watchdogs/?utm_source=facebook&utm_medium=social||Trump Signs New Executive Order Introducing Regulation Watchdogs||President Donald Trump signed another executive order on Friday that will require federal agencies to appoint regulation watchdogs to dissolve their power as rule makers.
6281||2017-02-25||http://www.breitbart.com/news/trump-wont-attend-white-house-correspondents-dinner/?utm_source=facebook&utm_medium=social||Trump Breaks Annual Tradition: Will Not Attend White House Correspondents Dinner||Washington (AFP) “ Donald Trump said Saturday he will not attend the White House Correspondents Dinner, breaking with an annual tradition in which the US president is the guest of honor at a light-hearted roast held by journalists.
6289||2017-02-25||http://www.breitbart.com/texas/2017/02/25/trump-supporters-in-texas-protest-against-civilizational-jihad/?utm_source=facebook&utm_medium=social||Trump Supporters in Texas Protest Against Civilizational Jihad||HOUSTON, Texas“ Trump supporters who are concerned about the civilizational jihad waged by open borders globalists, protested in Houston at an event put on by one of the non-profits they say receive millions on resettling refugees in American communities.
6290||2017-02-25||http://www.breitbart.com/video/2017/02/25/trump-losing-a-lot-of-best-jobs-to-other-countries-has-very-badly-hurt-african-american-community/?utm_source=facebook&utm_medium=social||Trump: Losing A Lot of Best Jobs To Other Countries Has Very Badly Hurt African-American Community||During Saturdays Weekly Address, President Trump stated, Weve lost a lot of our best jobs to other countries, and this has hurt the African-American community very badly.
6308||2017-02-24||http://www.breitbart.com/video/2017/02/24/krauthammer-bannon-cpac-showed-brains-operation/?utm_source=facebook&utm_medium=social||Krauthammer on Bannon at CPAC: He Showed He Was the Brains of the Operation||Thursday on Fox News Channels Tucker Carlson Tonight, Washington Post columnist Charles Krauthammer reacted to the joint appearance of White House chief strategist Stephen K. Bannon and chief of staff Reince Priebus earlier in the day at the Conservative Political Action Conference.
6319||2017-02-24||http://www.breitbart.com/big-government/2017/02/24/new-yorker-steve-bannon-conquered-cpac-republican-party/?utm_source=facebook&utm_medium=social||The New Yorker: How Steve Bannon Conquered CPAC and the Republican Party||The New Yorkers Ryan Lizza writes that the populist nationalist worldview of Donald Trumps White House chief strategist Steve Bannon has finally conquered the American Conservative Unions annual CPAC conference. 
6326||2017-02-24||http://www.breitbart.com/video/2017/02/24/trump-we-are-fighting-fake-news-they-shouldnt-be-allowed-to-use-anonymous-sources-cnn-clinton-news-network/?utm_source=facebook&utm_medium=social||Trump: We Are Fighting Fake News “ They Shouldnt Be Allowed To Use Anonymous Sources, CNN Clinton News Network||During his speech at CPAC on Friday, President Trump dubbed CNN the Clinton News Network, and said, we are fighting the fake news. And that hes against the people that make up stories, and make up sources. They shouldnt be allowed to use sources unless they use somebodys name.
6346||2017-02-23||http://www.breitbart.com/big-government/2017/02/23/steve-bannon-details-trump-agenda-deconstruction-administrative-state/?utm_source=facebook&utm_medium=social||Steve Bannon Details Trump Agenda: Deconstruction of the Administrative State||White House chief strategist Steve Bannon detailed President Donald Trumps agenda during an appearance at CPAC, thrilling the audience of conservatives who wanted to hear more about what Trump would do as president.
6350||2017-02-23||http://www.breitbart.com/big-government/2017/02/23/cpac-steve-bannon-reince-priebus-call-out-opposition-party-the-media-its-always-wrong/?utm_source=facebook&utm_medium=social||CPAC” Steve Bannon, Reince Priebus Call Out Opposition Party [the Media]: Its Always Wrong||Donald Trumps White House chief of staff Reince Priebus and senior advisor Stephen K. Bannon appeared before a packed house at CPAC on Thursday, rallying conservatives to support the presidents agenda and taking shots at the media.
6352||2017-02-23||http://www.breitbart.com/big-government/2017/02/23/cpac-bannon-priebus-address-cpac/?utm_source=facebook&utm_medium=social||In Show of Unity, Bannon, Priebus Address CPAC and the Opposition||OXON HILL, MD ” White House Chief Strategist Stephen K. Bannon and White House Chief of Staff Reince Priebus received a standing ovation and a heroes welcome at the Conservative Political Action Conference (CPAC) on Thursday afternoon.
6370||2017-02-22||http://www.breitbart.com/big-government/2017/02/22/trump-wine-boycott-wegmans-backfires/?utm_source=facebook&utm_medium=social||Trump Wine Boycott at Wegmans Backfires||A boycott of Trump Winery products sold at Wegmans stores in Virginia appeared to backfire after the wine sold out at stores in the area.
6380||2017-02-20||http://www.breitbart.com/national-security/2017/02/20/trump-chooses-army-general-h-r-mcmaster-national-security-adviser/?utm_source=facebook&utm_medium=social||Trump Chooses Army General H.R. McMaster for National Security Adviser||On Monday, the White House announced Army Lt. General H.R. McMaster as the replacement for Michael Flynn as National Security Adviser.
6415||2017-02-21||http://www.breitbart.com/big-hollywood/2017/02/21/george-clooney-trump-bannon-real-hollywood-elitists/?utm_source=facebook&utm_medium=social||George Clooney: Trump and Bannon the Real Hollywood Elitists||Actor George Clooney unloaded on President Donald Trump and White House chief strategist Steve Bannon in an interview, calling the pair the real Hollywood elitists.
6490||2017-02-18||http://www.breitbart.com/video/2017/02/18/trump-we-must-realize-the-full-potential-of-women-in-our-economy/?utm_source=facebook&utm_medium=social||Trump: We Must Realize the Full Potential of Women in Our Economy||During Fridays Weekly Address, President Donald Trump discussed the importance of women to the economy, saying he will deliver on his promise to help women in the workforce and ensuring they have equal access to the capital, markets and networks of support that they need.
6498||2017-02-15||http://www.breitbart.com/big-government/2017/02/15/trump-really-sending-feds-chicago-help-deal-violence/?utm_source=facebook&utm_medium=social||Trump Really Is Sending the Feds to Chicago to Help Deal with Violence||Before his inauguration and since taking office, Donald J. Trump has repeatedly said he would send the feds into Chicago to help the city deal with its incessant gang violence and out of control murder rate. Now a report notes that members of Trumps Department of Justice will soon visit The Windy City to do just that.
6510||2017-02-18||http://www.breitbart.com/big-government/2017/02/18/trump-replays-campaign-promises-slams-dishonest-media-at-florida-rally/?utm_source=facebook&utm_medium=social||Trump Replays Campaign Promises, Slams Dishonest Media at Florida Rally||MELBOURNE, FL “ Despite the unprecedented negative media coverage, President Donald Trumps supporters are as enthusiastic as ever.
6567||2017-02-16||http://www.breitbart.com/big-journalism/2017/02/16/steve-bannon-jokes-about-white-house-reporters-opposition-party-all-lined-up/?utm_source=facebook&utm_medium=social||Steve Bannon Jokes About White House Reporters: Opposition Party All Lined Up||President Donald Trumps chief strategist and former Breitbart News executive chairman Steve Bannon jokingly described a group of reporters as the opposition party all lined up when he walked past them outside the White House press secretarys office on Wednesday.
6577||2017-02-16||http://www.breitbart.com/video/2017/02/16/trump-i-inherited-a-mess/?utm_source=facebook&utm_medium=social||Trump: I Inherited a Mess||During his Thursday press conference naming Alexander Acosta his nominee to be Secretary of Labor, President Donald Trump discussed the state of the country when he entered office, saying he inherited a mess.
6594||2017-02-16||http://www.breitbart.com/video/2017/02/16/trump-slams-dishonest-press-tremendous-disservice-america-people/?utm_source=facebook&utm_medium=social||Trump Slams Dishonest Press for Tremendous Disservice to the American People||Thursday at a press conference to announce his pick of Alexander Acosta for the vacant Secretary of Labor post, President Donald Trump ripped the dishonest press and suggested they intentionally being an obstacle to his effort to take the entrenched power structure.
6600||2017-02-16||http://www.breitbart.com/national-security/2017/02/16/trump-welcomes-wife-venezuelan-political-prisoner-white-house/?utm_source=facebook&utm_medium=social||Trump Welcomes Wife of Venezuelan Political Prisoner, Keeping Vow to Oppressed Latinos||President Donald Trump met Lilian Tintori, the wife of Venezuelas most prominent prisoner of conscience, at the White House Wednesday night, demanding freedom for Popular Will party leader Leopoldo LÃ³pez immediately.
6602||2017-02-16||http://www.breitbart.com/big-government/2017/02/16/trump-vows-catch-low-life-leakers-washington-d-c/?utm_source=facebook&utm_medium=social||Trump Vows to Catch Low Life Leakers in Washington D.C.||President Donald J. Trump is already tired of the leaks coming from his administration, and vows to catch those involved in the criminal act.
6615||2017-02-15||http://www.breitbart.com/big-journalism/2017/02/15/vice-steve-bannon-promised-remaking-america/?utm_source=facebook&utm_medium=social||Vice: Steve Bannon Promised a Remaking of America||Reid Cherlin writes in Vice News about a 2014 encounter he had with then Breitbart News executive chairman and current Trump White House chief strategist Steve Bannon. 
6623||2017-02-15||http://www.breitbart.com/big-journalism/2017/02/15/steve-bannon-care-less-repairing-relationship-opposition-party-media/?utm_source=facebook&utm_medium=social||Steve Bannon: I Could Care Less About Repairing Relationship with Opposition Party Media||White House chief strategist Steve Bannon said he could care less about repairing a relationship with the mainstream media, which he continues to characterize as the Trump administrations opposition party.
6669||2017-02-13||http://www.breitbart.com/national-security/2017/02/13/trump-meets-trudeau-discuss-profound-shared-economic-interests-security-concerns/?utm_source=facebook&utm_medium=social||Trump Defends Refugee Policy In Trudeau Meeting: Im Just Doing What I Said I Would Do||Canadian Prime Minister Justin Trudeau met with President Donald Trump at the White House on Monday to discuss trade, security, and the challenges faced by women in the workforce, among other issues. 
6701||2017-02-13||http://www.breitbart.com/sports/2017/02/13/president-trump-goes-after-mavericks-owner-mark-cuban-spar-in-sunday-morning-twitter-exchange/?utm_source=facebook&utm_medium=social||President Trump Goes After Mavericks Owner Mark Cuban Spar in Sunday Morning Twitter Exchange||President Trump wasted no time on social media Sunday morning, and one of several tweets was directed at Dallas Mavericks Owner Mark Cuban.
6712||2017-02-12||http://www.breitbart.com/jerusalem/2017/02/12/guardian-column-suggests-trump-bannon-want-massacre-americans/?utm_source=facebook&utm_medium=social||Guardian Opinion Writer: Trump, Bannon Counting On Terrorist Massacre||Writing at the Guardian newspaper, global warming advocate Bill McKibben claimed that President Donald Trump and White House Chief Strategist Steve Bannon are counting on a terrorist massacre on American soil to tilt things their way.
6716||2017-02-12||http://www.breitbart.com/big-government/2017/02/12/trump-jobs-boom-another-round-companies-invest/?utm_source=facebook&utm_medium=social||Trump Jobs Boom: Another Round of Companies Announce Investments in U.S.||As Donald J. Trump continues to settle in at the White House, companies are still announcing new jobs and larger investments in America, many citing the president as their reason.
6748||2017-02-11||http://www.breitbart.com/big-government/2017/02/11/trump-denies-increased-border-wall-cost-promises-price-will-come-way-down/?utm_source=facebook&utm_medium=social||Trump Denies Increased Border Wall Cost, Promises Price Will Come Way Down||President Donald Trump dismissed recent reports suggesting that the cost of constructing a wall on the U.S.-Mexican border could be nearly double what he anticipates, promising that when he begins negotiations the price will come way down.
6778||2017-02-10||http://www.breitbart.com/video/2017/02/10/trump-new-steps-next-week-keep-country-safe/?utm_source=facebook&utm_medium=social||Trump: New Steps Next Week to Keep Country Safe||Friday at the White House, during a joint press conference with Japanese Prime Minister Shinzo Abe, when asked about the 9th Circuit Court ruling upholding the blocking of his executive order banning immigrants from seven Muslim-majority countries from entering the United States, President Donald Trump said new steps would be forthcoming next week.
6785||2017-02-10||http://www.breitbart.com/big-journalism/2017/02/10/fake-news-huffpo-invents-steve-bannon-war-pope-francis/?utm_source=facebook&utm_medium=social||Fake News: HuffPo Invents a Steve Bannon War on Pope Francis||The left-wing Huffington Post stooped to innuendo, slurs, and outright fabrication to manufacture out of whole cloth a dark conspiracy by Donald Trumps chief strategist Stephen K. Bannon against Pope Francis.
6794||2017-02-10||http://www.breitbart.com/big-hollywood/2017/02/10/desperate-rosie-odonnell/?utm_source=facebook&utm_medium=social||Bitter Rosie ODonnell Posts Photoshopped Bannon Pic in Bid for SNL Gig||Rosie ODonnell ratcheted up her social media-driven ploy to play White House chief strategist Steve Bannon on Saturday Night Live, updating her official Twitter profile picture Thursday night with a bizarre, Photoshopped image of her as Bannon.
6806||2017-02-09||http://www.breitbart.com/video/2017/02/09/huffpo-accidentally-makes-badass-video-bannon/?utm_source=facebook&utm_medium=social||HuffPo Accidentally Makes Badass Video of Steve Bannon||In an attempt to paint White House chief strategist Steve Bannon as a dangerous warmonger and ideologue, the Huffington Post unwittingly created a badass highlight reel of some of Bannons greatest hits.
6810||2017-02-08||http://www.breitbart.com/big-government/2017/02/08/zionist-organization-america-demand-pelosi-retract-baseless-untrue-slander-steve-bannon/?utm_source=facebook&utm_medium=social||Zionist Group Demands Pelosi Retract Slander Against Bannon||The Zionist Organization of America (ZOA), a prominent pro-Israel group, is calling on Congresswoman Nancy Pelosi (D-CA) to retract her recent comments calling White House chief strategist and former Breitbart News executive chairman Steve Bannon a white supremacist.
6831||2017-02-08||http://www.breitbart.com/big-government/2017/02/08/donald-trump-wall-getting-designed-right-now/?utm_source=facebook&utm_medium=social||Donald Trump: The Wall Is Getting Designed Right Now||President Donald Trump said his proposed wall on the Southern border of the United States is currently in the design phase.
6911||2017-02-06||http://www.breitbart.com/big-journalism/2017/02/06/usa-today-equates-steve-bannon-islamic-state-leader/?utm_source=facebook&utm_medium=social||USA TODAY Equates Steve Bannon with Terrorist Islamic State Leader||Mondays editorial in USA Today likens White House Chief Strategist and former Breitbart News Executive Chairman Stephen K. Bannon to Abu Bakr al-Baghdadi, the leader of the so-called Islamic State (ISIS, or ISIL) terrorist caliphate.
6929||2017-02-04||http://www.breitbart.com/video/2017/02/04/trump-were-working-to-deliver-for-american-workers-and-families-law-abiding-citizens-are-my-total-priority/?utm_source=facebook&utm_medium=social||Trump: Were Working to Deliver for American Workers and Families “ Law-Abiding Citizens Are My Total Priority||During Fridays Weekly Address, President Trump recapped the past week, saying, On every single front, we are working to deliver for American workers and American families. You, the law-abiding citizens of this country, are my total priority. Your safety, your jobs and your wages guide our decisions.
6940||2017-02-05||http://www.breitbart.com/big-government/2017/02/05/quartz-steve-bannon-really-wants/?utm_source=facebook&utm_medium=social||Quartz: What Steve Bannon Really Wants||Gwynn Guilford and Nikhil Sonnad of Quartz profile Stephen K. Bannons (or, to those who wish to maximize their SEO, Steve Bannon) beliefs based on his public statements ” past interviews, speeches, and films.
7008||2017-02-03||http://www.breitbart.com/big-government/2017/02/03/gun-charge-dropped-gorka/?utm_source=facebook&utm_medium=social||Trump Deputy Assistant Sebastian Gorka Reveals Death Threats||Authorities dismissed a misdemeanor gun charge against Trump Deputy Assistant Sebastian Gorka Friday after a lengthy process revealed Gorka and his family had received a flurry of death threats related to their counterterrorism work.
7027||2017-02-01||http://www.breitbart.com/big-government/2017/02/01/trump-already-raised-over-7-million-for-2020-re-election-campaign/?utm_source=facebook&utm_medium=social||Trump Already Raised Over $7 Million for 2020 Re-Election Campaign||President Trump started off 2017 with more than $7 million in his campaign coffers, according to new Federal Election Commission filings.
7045||2017-02-02||http://www.breitbart.com/big-government/2017/02/02/trump-celebrates-americas-faith-based-foundation-vows-defend-religious-values/?utm_source=facebook&utm_medium=social||Trump Celebrates Americas Faith-Based Foundation, Vows to Defend Religious Values||President Donald Trump praised Americas faith-based values, vowing to defend them from an increasingly dangerous world, in a speech at the National Prayer Breakfast Thursday.
7072||2017-01-31||http://www.breitbart.com/big-government/2017/01/31/trump-continue-enforce-obamas-executive-order-protecting-lgbtq-federal-workers/?utm_source=facebook&utm_medium=social||Trump to Keep Obama Executive Order Protecting LGBTQ Federal Workers||An executive order signed by former President Barack Obama in 2014 protecting federal employees from anti-LGBTQ discrimination will continue to be enforced under the Trump administration, the White House announced Tuesday.
7074||2017-01-31||http://www.breitbart.com/big-government/2017/01/31/trump-scotus-nominee-2nd-amendment-protects-individual-right/?utm_source=facebook&utm_medium=social||Trump SCOTUS Nominee: 2nd Amendment Protects an Individuals Right||President Trumps nominee to the Supreme Court of the United States is Neil Gorsuch, a judge on the United State Court of Appeals for the 10th Circuit who has written that the Second Amendment protects an individuals right.
7088||2017-02-01||http://www.breitbart.com/video/2017/02/01/trump-i-dont-watch-cnn-because-i-dont-like-watching-fake-news/?utm_source=facebook&utm_medium=social||Trump: I Dont Watch CNN Because I Dont Like Watching Fake News||During a listening session for Black History Month on Wednesday, President Donald Trump said, I dont watch CNN. ¦ I dont like watching fake news.
7104||2017-01-31||http://www.breitbart.com/big-journalism/2017/01/31/virgil-the-real-purpose-of-the-lefts-permanent-campaign-against-steve-bannon/?utm_source=facebook&utm_medium=social||Virgil: The Real Purpose of the Lefts Permanent Campaign Against Steve Bannon||In the past, Virgil has taken note of various Main Stream Media tricks, such as the false argument from authority and the assertion of a false conflict. 
7106||2017-01-30||http://www.breitbart.com/big-government/2017/01/30/trumps-patco-moment-emanating-reagan-president-takes-control-federal-government-protect-country-citizens/?utm_source=facebook&utm_medium=social||Trumps PATCO Moment: Emanating Reagan, the President Takes Control of Federal Government to Protect the Country and Its Citizens||President Donald Trumps firing of a politically motivated official”now-former Acting Attorney General Sally Yates, for her refusal to enforce the laws of the nation and carry out the administrations policy”harkens back to a previous president who faced a similar crisis at the beginning of his administration.
7112||2017-01-31||http://www.breitbart.com/big-government/2017/01/31/trump-nominates-judge-neil-gorsuch-supreme-court/||Trump Nominates Judge Neil Gorsuch to Supreme Court||WASHINGTON ” President Donald Trump nominated Judge Neil Gorsuch on Tuesday evening to fill the seat on the U.S. Supreme Court left open by the sudden death of Justice Antonin Scalia in February 2016.
7115||2017-01-31||http://www.breitbart.com/news/trump-announcing-supreme-court-pick-tuesday-night/||Trump announcing Supreme Court pick Tuesday night||WASHINGTON (AP) ” President Donald Trump was poised Tuesday to announce his choice to fill the vacancy on the Supreme Court, one of the most consequential moves of his young administration and a decision with ramifications that could long outlast his time in office.
7133||2017-01-31||http://www.breitbart.com/video/2017/01/31/trump-supporter-knocked-unconscious-by-protester-at-portland-international-airport/?utm_source=facebook&utm_medium=social||Trump Supporter Knocked Unconscious by Protester at Portland International Airport||A Donald Trump supporter was knocked out and suffered a concussion after being attacked by a protester at Portland International Airport, says a Daily Mail report.
