id||pub_date||link||headline||par1
5||2017-08-23||http://www.breitbart.com/economics/2017/08/23/trump-well-probably-end-up-terminating-nafta/?utm_source=facebook&utm_medium=social||Trump: Well Probably End up Terminating NAFTA||Donald Trump sent a warning to Mexico on Tuesday night about the NAFTA renegotiations.
16||2017-08-22||http://www.breitbart.com/big-government/2017/08/22/trump-hints-at-pardon-sheriff-joe-can-feel-good/?utm_source=facebook&utm_medium=social||Trump Hints at Pardon: Sheriff Joe Can Feel Good!||President Donald Trump all but announced a pardon of convicted Maricopa County Sheriff Joe Arpaio at his Tuesday night rally in Phoenix, AZ.
30||2017-08-20||http://www.breitbart.com/big-government/2017/08/20/politico-bannon-intellectual-heart-movement-who-would-rather-work-weekends-than-party-in-hamptons/?utm_source=facebook&utm_medium=social||Politico: Bannon Intellectual Heart of Movement Who Would Rather Work Weekends than Party in Hamptons||Former White House Chief Strategist Steve Bannon is the intellectual heart and soul of President Donald Trumps nationalist-populist movement who was laser-focused on [Trumps] promises scrawled onto his office wall, which Politico reported was in storage while the White House was undergoing renovations.
33||2017-08-20||http://www.breitbart.com/video/2017/08/20/david-bossie-bannon-will-loyal-soldier-trump-outside/?utm_source=facebook&utm_medium=social||David Bossie: Bannon Will Be a Loyal Soldier to Trump From the Outside||On this weekends broadcast of Fox News Sunday, David Bossie, formerly of President Donald Trumps 2016 election campaign, said after leaving his position of chief strategist Steve Bannon will be a loyal soldier to Trump from the outside.
37||2017-08-21||http://www.breitbart.com/national-security/2017/08/21/trump-debuts-afghanistan-strategy-we-are-not-nation-building-again-we-are-killing-terrorists/?utm_source=facebook&utm_medium=social||Trump Debuts Afghanistan Strategy: We Are Not Nation-Building Again, We Are Killing Terrorists||President Trump unveiled his plan for Afghanistan after seven months of deliberation Monday evening, announcing tweaks around the edges of the current strategy instead of a different approach.
38||2017-08-21||http://www.breitbart.com/jerusalem/2017/08/21/report-bannon-urged-trump-move-u-s-embassy-jerusalem-blocked-jared-kushner/?utm_source=facebook&utm_medium=social||Report: Bannon Urged Trump to Move U.S. Embassy to Jerusalem ” Was Blocked by Jared Kushner||TEL AVIV “ According to a report in Vanity Fair, while he served as White House chief strategist, Steve Bannon heavily lobbied President Trump to move the U.S. embassy from Tel Aviv to Israels capital, Jerusalem, but the move was blocked by Jared Kushner, President Trumps son-in-law and senior adviser.
54||2017-08-21||http://www.breitbart.com/big-government/2017/08/21/trumps-america-first-base-unhappy-with-flip-flop-afghanistan-speech/||Trumps America First Base Unhappy with Flip-Flop Afghanistan Speech||President Trumps America First base was the biggest loser of Trumps speech on Afghanistan Monday night, and many quickly expressed their disappointment at the business-as-usual address from the president who had once promised to limit American intervention abroad and focus on nation-building at home.
62||2017-08-21||http://www.breitbart.com/news/trump-says-us-cant-afford-quick-afghanistan-withdrawal/||Trump says US cant afford quick Afghanistan withdrawal||WASHINGTON (AP) ” President Donald Trump declared Monday night the United States must continue fighting in Afghanistan to avoid the predictable and unacceptable results of a rapid withdrawal from the country where the U.S. has been at war for 16 years.
80||2017-08-21||http://www.breitbart.com/big-journalism/2017/08/21/columbia-univ-professor-bannon-right-econ-nationalism-will-trump-dems-identity-politics/?utm_source=facebook&utm_medium=social||Columbia Univ. Prof: Bannon Right“Economic Nationalism Will Trump Dems Identity Politics||A liberal Columbia University professor agreed with President Donald Trumps former Chief Strategist Steve Bannon that Democrats will just keep losing if they make everything about racism and identity politics.
91||2017-08-20||http://www.breitbart.com/video/2017/08/20/charles-hurt-bannon-a-disruptor-very-good-charging-the-gates-from-the-outside/?utm_source=facebook&utm_medium=social||Charles Hurt: Bannon a Disruptor ” Very Good Charging the Gates From the Outside||On this weekends broadcast of Fox News Sunday, Washington Times opinion editor Charles Hurt said Steve Bannon was very good charging the gates from the outside.
100||2017-08-20||http://www.breitbart.com/big-journalism/2017/08/20/hollywood-reporter-inside-steve-bannons-first-day-back-breitbart/||The Hollywood Reporter: Inside Steve Bannons First Day Back at Breitbart||Paul Bond at The Hollywood Reporter got the scoop on Stephen K. Bannons first day back as Breitbart News executive chairman after resigning his position at President Trumps chief strategist.
108||2017-08-19||http://www.breitbart.com/big-journalism/2017/08/19/politico-breitbart-bullish-bannon-return-promises-aggressive-expansion/?utm_source=facebook&utm_medium=social||Politico: Breitbart Bullish on Bannon Return, Promises Aggressive Expansion||Cristiano Lima writes for Politico about the excitement and optimism at Breitbart News with the return of Executive Chairman Stephen K. Bannon, predicting that The new Steve Bannon era at Breitbart likely means more of its attacks on centrist Republicans:
113||2017-08-20||http://www.breitbart.com/big-government/2017/08/20/trump-nixes-obama-ban-plastic-bottles-national-parks/?utm_source=facebook&utm_medium=social||Trump Nixes Obama Ban on Plastic Bottles at National Parks||The Trump administration nixed former President Barack Obamas ban on selling plastic bottles at all national parks, according to the Department of the Interior.
114||2017-08-20||http://www.breitbart.com/big-government/2017/08/20/rep-mo-brooks-bannon-washington-swamp-taken-control-white-house/?utm_source=facebook&utm_medium=social||Rep. Mo Brooks on Bannon: Washington Swamp Have Taken Control of the White House||Rep. Mo Brooks (R., Ala.) ” who finished third in last weeks Senate vote between establishment favorite Sen. Luther Strange (R., Ala.) and conservative firebrand and former state Supreme Court justice Roy Moore ” said Steve Bannons West Wing departure and President Trumps endorsement of Sen. Strange is a sign that the establishment swamp has seized control of the White House.
133||2017-08-19||http://www.breitbart.com/big-government/2017/08/19/donald-trump-steve-bannon-tough-smart-voice-at-breitbart-news-fake-news-needs-competition/?utm_source=facebook&utm_medium=social||Donald Trump: Steve Bannon Tough, Smart Voice at Breitbart News, Fake News Needs the Competition||President Donald Trump tweeted out support for his now former Chief Strategist Stephen K. Bannon on Saturday and for Bannons return to Breitbart News.
135||2017-08-19||http://www.breitbart.com/video/2017/08/19/mark-steyn-bannon-departure-makes-trump-admin-ordinary-trump-voter-wanted-something-extraordinary/?utm_source=facebook&utm_medium=social||Mark Steyn: Bannon Departure Makes Trump Admin More Ordinary ” Trump Voter Wanted Something Extraordinary||Friday on Fox News Channels Tucker Carlson Tonight, conservative commentator Mark Steyn reacted to the news of the departure of Steve Bannon from the Trump administration earlier in the day.
142||2017-08-18||http://www.breitbart.com/video/2017/08/18/david-bossie-bannon-100-committed-helping-trump-fulfill-promises/?utm_source=facebook&utm_medium=social||David Bossie: Bannon Is 100% Committed to Helping Trump Fulfill His Promises||Friday on Fox News Channels Special Report, David Bossie, formerly of President Donald Trumps 2016 election campaign, said now that Steve Bannon was on the outside the administration, he had a lot more weapons at his disposal to help Trump fulfill the list of promises made during the campaign.
146||2017-08-19||http://www.breitbart.com/news/trump-studying-options-for-new-approach-to-afghan-war/?utm_source=facebook&utm_medium=social||Trump studying options for new approach to Afghan war||WASHINGTON (AP) ” President Donald Trump is studying and considering his options for a new approach to Afghanistan and the broader South Asia region, the White House said Friday after the president huddled with his top national security aides at Camp David.
152||2017-08-19||http://www.breitbart.com/big-government/2017/08/19/wapo-bannons-next-move-return-breitbart-news-reach-ever/?utm_source=facebook&utm_medium=social||WaPo “ Bannons Next Move: A Return to Breitbart News, with More Reach Than Ever||From Matea Gold and Paul Farhi writing at the Washington Post:
153||2017-08-19||http://www.breitbart.com/big-government/2017/08/19/great-trump-thanks-bannon-service/?utm_source=facebook&utm_medium=social||It Was Great! ” Donald Trump Thanks Steve Bannon for His Service||President Donald Trump thanked his former White House strategist Steve Bannon for his service after he left the administration on Friday.
156||2017-08-19||http://www.breitbart.com/london/2017/08/19/raheem-kassam-now-steve-bannon-knows-who-the-enemies-of-the-american-people-are/?utm_source=facebook&utm_medium=social||Raheem Kassam: Now Steve Bannon Knows Who The Enemies of the American People Are||Steve Bannon, the outgoing White House chief strategist now knows who the enemies of the American people are after seven months working within the government, Breitbart London editor in chief Raheem Kassam has said.
159||2017-08-18||http://www.breitbart.com/video/2017/08/18/carlson-bannon-one-trump-wh-wouldnt-feel-home-working-hillary-clinton/||Carlson: Bannon One of Few in Trump WH Who Wouldnt Feel at Home Working for Hillary Clinton||Friday on Fox News Channels Tucker Carlson Tonight, host Tucker Carlson reacted to Trump chief strategist Steve Bannons departure from the White House earlier in the day.
160||2017-08-15||http://www.breitbart.com/big-government/2017/08/15/trump-says-better-jobs-and-wages-will-heal-american-race-relations/?utm_source=facebook&utm_medium=social||Trump Says Better Jobs and Wages Will Heal American Race Relations||The Make American Great Again economic program will improve race relations in the U.S., President Donald Trump said at a fiery press conference held in New York Citys Trump Tower on Tuesday.
171||2017-08-18||http://www.breitbart.com/big-government/2017/08/18/coulter-to-trump-if-you-didnt-want-bannon-to-take-all-the-credit-you-shouldve-hired-10-more-like-him/?utm_source=facebook&utm_medium=social||Coulter to Trump: If You Didnt Want Bannon to Take All the Credit You Shouldve Hired 10 More Like Him||In a series of tweets on Friday after the news broke that President Donald Trumps chief strategist Steve Bannon had stepped down, author and conservative pundit Ann Coulter praised Bannon and offered some advice to the president.
174||2017-08-18||http://www.breitbart.com/big-government/2017/08/18/steve-bannon-speaks-after-white-house-departure-im-going-to-war-for-trump/||Steve Bannon Speaks After White House Departure: Im Going to War for Trump||Recently departed White House strategist Steve Bannon is preparing a war for Donald Trump, not against him.
176||2017-08-18||http://www.breitbart.com/big-journalism/2017/08/18/populist-hero-stephen-k-bannon-returns-home-breitbart/?utm_source=facebook&utm_medium=social||Populist Hero Stephen K. Bannon Returns Home to Breitbart||Former White House Chief Strategist Stephen K. Bannon returned as Executive Chairman of Breitbart News Friday afternoon and chaired the companys evening editorial meeting.
177||2017-08-18||http://www.breitbart.com/big-government/2017/08/18/goy-bye-white-flight-huffpost-loses-the-plot-turns-bannon-departure-into-race-war/?utm_source=facebook&utm_medium=social||Goy, Bye! White Flight HuffPost Loses the Plot, Turns Bannon Departure into Race War||HuffPost, the left-wing online tabloid formerly known as the Huffington Post, depicted White House Chief Strategist Steve Bannons departure with a series racially and religiously-charged headlines.
181||2017-08-18||http://www.breitbart.com/big-hollywood/2017/08/18/hollywood-gleefully-cheers-bannon-white-house-exit/||Hollywood Celebrates Steve Bannon White House Exit: Shove a Tiki Torch Up Your Ass||Hollywood celebrities gleefully licked their chops Friday morning after news broke that Steve Bannon would be leaving his post as White House chief strategist.
182||2017-08-18||http://www.breitbart.com/big-government/2017/08/18/chief-strategist-steve-bannon-out-at-white-house-get-ready-for-bannon-the-barbarian/?utm_source=facebook&utm_medium=social||Chief Strategist Steve Bannon Out at White House: Get Ready for Bannon the Barbarian||White House Chief Strategist Steve Bannon ” the former Breitbart News executive chairman who helped guide then-candidate Donald Trumps flagging presidential campaign to a historic victory ” is on his way out of the White House, with a source close to Bannon telling Axios: Get ready for Bannon the barbarian.
183||2017-08-18||http://www.breitbart.com/big-government/2017/08/18/steve-bannon-out-white-house/?utm_source=facebook&utm_medium=social||Report: Steve Bannon out of White House, Submitted Resignation August 7||UPDATE: The White House confirms with a statement from Press Secretary Sarah Huckabee Sanders: White House Chief of Staff John Kelly and Steve Bannon have mutually agreed today would be Steves last day. We are grateful for his service and wish him the best.
192||2017-08-18||http://www.breitbart.com/big-government/2017/08/18/steve-bannon-democrats-not-understand-donald-trump-voters/?utm_source=facebook&utm_medium=social||Steve Bannon: Democrats Do Not Understand Donald Trump Voters||White House Strategist Steve Bannon continued to ridicule Democrats for focusing all of their political energy on race divisions, claiming they had no idea what inspired President Donald Trumps supporters to vote for him.
202||2017-08-17||http://www.breitbart.com/big-government/2017/08/17/cnn-focuses-on-bannon-not-barcelona-terrorism-at-state-department-briefing/?utm_source=facebook&utm_medium=social||CNN Focuses on Bannon, Not Barcelona Terrorism, at State Department Briefing||As the news of a terror attack in Barcelona reached the U.S. Department of State on Thursday ahead of a press conference with Secretary of State Rex Tillerson and Secretary of Defense James Mattis and their Japanese counterparts, a reporter from CNN, who got the first question following official statements, asked about White House Chief Strategist Steve Bannons interview with the Left-wing magazine The American Prospect.
233||2017-08-16||http://www.breitbart.com/big-government/2017/08/16/bannon-proud-trump-cohn-disgusted/?utm_source=facebook&utm_medium=social||Steve Bannon Proud of Trump; Gary Cohn Disgusted||President Donald Trumps chief economic adviser has told close associates that he was deeply upset by the presidents comments about the violence in Charlottesville, Virginia.
282||2017-08-15||http://www.breitbart.com/video/2017/08/15/trump-tearing-confederate-statues-george-washington-next/?utm_source=facebook&utm_medium=social||Trump on Tearing Down Confederate Statues: Is George Washington Next?||Tuesday at Trump Tower in New York City, President Donald Trump asked if the removal of Confederate statues like the statue of Gen. Robert E. Lee in Charlottesville, VA last week will lead to the removal of monuments to former Presidents George Washington or Thomas Jefferson.
291||2017-08-15||http://www.breitbart.com/big-government/2017/08/15/donald-trump-defends-friend-steve-bannon-a-good-man-who-gets-unfair-press/?utm_source=facebook&utm_medium=social||Donald Trump Defends Friend Steve Bannon: A Good Man Who Gets Unfair Press||President Donald Trump defended his White House Chief Strategist Steve Bannon, calling him a friend and a good man.
318||2017-08-14||http://www.breitbart.com/big-government/2017/08/14/fire-bannon-3-0-pelosi-calls-for-trump-to-ax-chief-strategist/||Fire Bannon 3.0: Pelosi Calls for Trump to Ax Chief Strategist||House Minority Leader Nancy Pelosi (D-CA) is calling on President Donald Trump to fire chief strategist Steve Bannon and other alt-right white supremacist sympathizers.
352||2017-08-13||http://www.breitbart.com/big-government/2017/08/13/scaramucci-nasty-stuff-breitbart-disgusting/?utm_source=facebook&utm_medium=social||Mooch on the Loose: Nasty Breitbart is Disgusting, Bannon Has No Influence But Must Go||Appearing on a Facebook livestream on Sunday morning, former White House Communications Director Anthony Scaramucci lashed out at Breitbart News and its former executive chairman, fresh from heaping praise on Jared Kushner and his wife Ivanka on ABC News, and despite having lauded Breitbart News just 22 days ago.
372||2017-08-13||http://www.breitbart.com/video/2017/08/13/scaramucci-trump-move-away-bannon-bart-nonsense/?utm_source=facebook&utm_medium=social||Scaramucci: Trump Has to Move Away from Bannon-Bart Nonsense||Sunday on ABCs This Week, while discussing President Donald Trumps statement on the violence Saturday at a Charlottesville protest, former White House communications director Anthony Scaramucci said President Donald Trump needed to move away from the Bannon-Bart influence, referring to Breitbart News Network and White House chief strategist Stephen K. Bannon.
389||2017-08-12||http://www.breitbart.com/big-journalism/2017/08/12/steve-bannon-encourages-jeffrey-lord-to-keep-fighting-on-no-apologies-tour/?utm_source=facebook&utm_medium=social||Steve Bannon Encourages Jeffrey Lord to Keep Fighting on No Apologies Tour After CNN Purge||Hours after CNN fired pro-Trump commentator Jeffrey Lord for mocking Nazis and fascists with a Sieg Heil tweet, White House Chief Strategist Steve Bannon reportedly called Lord to encourage him to keep fighting on what Lord said would be his no apologies tour.
414||2017-08-07||http://www.breitbart.com/california/2017/08/07/second-amendment-foundation-ca-travel/?utm_source=facebook&utm_medium=social||2nd Amendment Foundation Issues Travel Advisory: Your Gun Rights Are No Good in California||On August 7, the Second Amendment Foundation (SAF) issued its first ever travel advisory warning American gun owners not to go to California unless they are willing to enter the state disarmed or risk going to jail.
433||2017-08-11||http://www.breitbart.com/big-government/2017/08/11/trump-fans-gleefully-appropriate-trump-chicken-meme-magic/?utm_source=facebook&utm_medium=social||Trump Fans Gleefully Appropriate Trump Chicken for Meme Magic||After liberal protesters set up a 30-foot inflatable chicken outside the White House, President Trumps supporters joyfully appropriated the image for their memes.
487||2017-08-09||http://www.breitbart.com/video/2017/08/09/buchanan-economic-nationalism-goes-pretty-much-window-bannon-leaves-white-house/?utm_source=facebook&utm_medium=social||Buchanan: Economic Nationalism Goes Pretty Much Out the Window If Bannon Leaves White House||Wednesday on Laura Ingrahams nationally syndicated radio show, conservative commentator Pat Buchanan warned that if White House chief strategist Steve Bannon were to depart the Trump administration, it would mean the end of economic nationalism, one of the elements of Trumps 2016 campaign.
517||2017-08-07||http://www.breitbart.com/big-government/2017/08/07/trump-second-100-days-15-highs-lows/?utm_source=facebook&utm_medium=social||Trumps Second 100 Days: 15 Highlights and Lowlights||August 7 marks President Donald Trumps second 100 days in office. They were just as intense as the first 100, if not more so.
587||2017-08-06||http://www.breitbart.com/texas/2017/08/06/trump-immigration-crackdown-leads-higher-construction-wages/?utm_source=facebook&utm_medium=social||Trump Immigration Crackdown Leads to Higher Construction Wages||President Donald Trumps crackdown on illegal immigration is already having a positive impact on American workers through increased wages in the construction industry.
623||2017-08-05||http://www.breitbart.com/big-government/2017/08/05/more-leftist-hysteria-mag-says-gorka-bannon-worse-for-jews-than-anti-israel-radical-sarsour/?utm_source=facebook&utm_medium=social||More Leftist Hysteria: Mag Says Gorka, Bannon Worse for Jews Than Anti-Israel Radical Sarsour||Forward, a website claiming to inform American Jews, has published a hit piece on President Donald Trump, his staff, and his supporters.
624||2017-08-05||http://www.breitbart.com/video/2017/08/05/trump-immigration-proposal-ends-the-abuse-of-our-welfare-system-and-protects-our-workers-and-our-economy/?utm_source=facebook&utm_medium=social||Trump: Immigration Proposal Ends the Abuse of Our Welfare System and Protects Our Workers and Our Economy||During Fridays Weekly Address, President Trump argued the immigration reform proposal he put forward with Senators Tom Cotton (R-AR) and David Perdue (R-GA) ends the abuse of our welfare system, stops chain migration, and protects our workers and our economy.
629||2017-08-05||http://www.breitbart.com/big-government/2017/08/05/wapo-bannon-feels-trump-revolutionary-figure-world-stage/?utm_source=facebook&utm_medium=social||WaPo: Bannon Feels Trump Is Revolutionary Figure on World Stage||From Greg Jaffe and Philip Rucker writing at the Washington Post:
636||2017-08-05||http://www.breitbart.com/texas/2017/08/05/trump-deporting-children-mere-suspicion-gang-membership-says-aclu/||Trump Deporting Children for Mere Suspicion of Gang Membership, Says ACLU||The American Civil Liberties Union (ACLU) in New York claims that President Trump wants to deport children based on mere suspicion of gang affiliation.
652||2017-08-04||http://www.breitbart.com/big-government/2017/08/04/trump-jared-kushner-back-mcmaster-in-face-of-conservative-calls-for-ouster/||Trump Stands by McMaster, Claims Hes Very Pro-Israel||President Trump defied his base Friday and defended under-fire national security adviser Lt. Gen. H.R. McMaster from accusations that he is anti-Israel and opposed to the presidents agenda ” as calls for his firing among conservatives heat up.
660||2017-08-04||http://www.breitbart.com/video/2017/08/04/ag-jeff-sessions-need-wall/?utm_source=facebook&utm_medium=social||AG Jeff Sessions: We Need the Wall||In an interview that aired Thursday with Fox News Channels Tucker Carlson, Attorney General Jeff Sessions addressed how the government could prevent the flow of MS-13 gang members into the United States.
680||2017-08-03||http://www.breitbart.com/big-government/2017/08/03/trump-mocks-democrats-over-russia-probe-in-west-virginia-any-russians-here-tonight/?utm_source=facebook&utm_medium=social||Trump Mocks Democrats Over Russia Probe in West Virginia: Any Russians Here Tonight?||President Trump took aim at Democrats over their obsession with what he called the totally made up Russia story Thursday, telling a rambunctious crowd in West Virginia that the hubbub is merely an excuse for the greatest loss in the history of American politics.
681||2017-08-04||http://www.breitbart.com/video/2017/08/04/ag-jeff-sessions-need-wall/?utm_source=facebook&utm_medium=social||AG Jeff Sessions: We Need the Wall||In an interview that aired Thursday with Fox News Channels Tucker Carlson, Attorney General Jeff Sessions addressed how the government could prevent the flow of MS-13 gang members into the United States.
693||2017-08-03||http://www.breitbart.com/big-government/2017/08/03/trump-scorches-d-c-establishment-west-virginia-dont-need-advice-washington-swamp/?utm_source=facebook&utm_medium=social||Trump Scorches D.C. Establishment in West Virginia: We Dont Need Advice from the Washington Swamp||President Trump gave a full-throated populist speech at a packed rally in West Virginia Thursday, where he took aim at both Republican and Democratic lawmakers for their failures on everything from foreign policy to trade to the inability to scrap Obamacare.
711||2017-08-03||http://www.breitbart.com/big-government/2017/08/03/trump-transcripts-reveal-man-committed-private-public-maga/||Very Fake News: Trump DIDNT Say the Wall Wasnt Important, While Turnbull Admitted Refugees Were Economic Migrants||The propaganda press is already trying to have a field day with the Trump telephone transcripts that were just released, showcasing his conversations with the President of Mexico and Prime Minister of Australia. They think the calls make him look bad. Thats because their frame of reference is that of normal politicians.
726||2017-07-31||http://www.breitbart.com/big-government/2017/07/31/morning-joe-begs-wh-chief-kelly-sideline-nationalist-bannon-encouraging-trump-attack-opposition-media/?utm_source=facebook&utm_medium=social||Morning Joe Begs WH Chief Kelly to Sideline Nationalist Bannon for Encouraging Trump to Attack Opposition Media||There he goes again.
736||2017-08-02||http://www.breitbart.com/big-government/2017/08/02/trump-boom-dow-hits-22000-first-time-ever/?utm_source=facebook&utm_medium=social||Trump Boom: Dow Jones Hits 22,000 for First Time||The Dow Jones Industrial Average achieved yet another milestone Wednesday, hitting 22,000 for the first time in history.
770||2017-08-01||http://www.breitbart.com/big-government/2017/08/01/speaker-ryan-posts-video-of-visit-to-southern-border-its-time-for-the-wall/?utm_source=facebook&utm_medium=social||Speaker Ryan Posts Video of Visit to Southern Border: Its Time for the Wall||In a 30-second video of House Speaker Paul Ryans (R-WI) visit to the southern border of the United States posted online on Tuesday, Ryan said that border patrol agents need more tools ¦ to do their jobs effectively and vows to get this done this week.
